article_index,title,url,avg_label,avg_score,num_sentences,sentence,sent_label,sent_score,sent_value
16,NewsNews,https://www.bbc.com/news/world/australia,NEGATIVE,0.12093145506722587,28,"News News Australia Man catches fire after power bank overheats at Melbourne airport lounge Staff helped the man, aged in his 50s, into a shower and he was treated for burns to his leg and fingers.",NEGATIVE,0.9895886182785034,-0.9895886182785034
16,NewsNews,https://www.bbc.com/news/world/australia,NEGATIVE,0.12093145506722587,28,"3 days ago Australia Great Barrier Reef may partially recover from 'grim future' if global warming stays below 2C A new study has found certain corals are more resilient in warmer waters, giving hope to the world-famous reef.",NEGATIVE,0.6922330856323242,-0.6922330856323242
16,NewsNews,https://www.bbc.com/news/world/australia,NEGATIVE,0.12093145506722587,28,4 days ago Australia Cruise ship that left woman to die on island boarded by investigators Officials from the Australian Maritime Safety Authority boarded the Coral Adventurer on Wednesday morning local time.,NEGATIVE,0.9729640483856201,-0.9729640483856201
16,NewsNews,https://www.bbc.com/news/world/australia,NEGATIVE,0.12093145506722587,28,"4 days ago Australia Reddit added to Australia's social media ban on under-16s The ban takes effect on 10 December and also includes Facebook, X, TikTok, YouTube and Instagram.",NEGATIVE,0.9860986471176147,-0.9860986471176147
16,NewsNews,https://www.bbc.com/news/world/australia,NEGATIVE,0.12093145506722587,28,5 days ago Australia Australian teen charged over allegedly sticking googly eyes on 'Blue Blob' artwork A local council said the repairs to the bright blue sculpture would be 'significant'.,NEGATIVE,0.9826488494873047,-0.9826488494873047
16,NewsNews,https://www.bbc.com/news/world/australia,NEGATIVE,0.12093145506722587,28,"4 days ago Australia Cummins 'on track' to return for second Ashes Test Australia captain Pat Cummins says he is ""on track"" to play the second Ashes Test against England as he recovers from a back injury.",POSITIVE,0.9787991046905518,0.9787991046905518
16,NewsNews,https://www.bbc.com/news/world/australia,NEGATIVE,0.12093145506722587,28,3 days ago Australia 'Addictive' diaries win prestigious non-fiction prize Helen Garner's How to End a Story: Collected Diaries is first diary to win Baillie Gifford prize.,POSITIVE,0.9976525902748108,0.9976525902748108
16,NewsNews,https://www.bbc.com/news/world/australia,NEGATIVE,0.12093145506722587,28,"4 days ago Culture Features & Analysis 'Australia not a bunch of old-timers - they're an outstanding team' Australia's squad is older than England's and many are playing in their last Ashes, but they remain an outstanding team, says Stephan Shemilt.",POSITIVE,0.9996694326400757,0.9996694326400757
16,NewsNews,https://www.bbc.com/news/world/australia,NEGATIVE,0.12093145506722587,28,"Friendly Albanese-Trump meeting masks Australia's creeping doubts about US The talks in Washington were a win for Australia, but at home many are nervous about the relationship.",NEGATIVE,0.9632133841514587,-0.9632133841514587
16,NewsNews,https://www.bbc.com/news/world/australia,NEGATIVE,0.12093145506722587,28,Fatal attack revives debate over controversial shark nets in Australia The use of controversial shark nets was about to be scaled back in Sydney when a surfer was killed.,POSITIVE,0.996747612953186,0.996747612953186
16,NewsNews,https://www.bbc.com/news/world/australia,NEGATIVE,0.12093145506722587,28,The sunscreen scandal shocking Australia - the world's skin cancer hotspot It has shaken consumer trust and raised questions about global sunscreen regulation.,POSITIVE,0.971251368522644,0.971251368522644
16,NewsNews,https://www.bbc.com/news/world/australia,NEGATIVE,0.12093145506722587,28,Messages in a bottle from WWI soldiers found on Australian coast The notes were thrown overboard just a few days into a voyage to join the battlefields of France more than a century ago.,NEGATIVE,0.9983763694763184,-0.9983763694763184
16,NewsNews,https://www.bbc.com/news/world/australia,NEGATIVE,0.12093145506722587,28,Watch/Listen Slow-motion footage reveals secrets of snake bites Scientists working out of a venom laboratory in Paris studied which snakes strike their prey fastest.,NEGATIVE,0.7625542879104614,-0.7625542879104614
16,NewsNews,https://www.bbc.com/news/world/australia,NEGATIVE,0.12093145506722587,28,"Trump to Australian ambassador: 'I don't like you either' In 2020, Kevin Rudd wrote on social media that he believed Trump was the 'most destructive' president in US history.",NEGATIVE,0.9906964302062988,-0.9906964302062988
16,NewsNews,https://www.bbc.com/news/world/australia,NEGATIVE,0.12093145506722587,28,"Watch: Millions of red crabs begin annual migration on Christmas Island The island off mainland Australia experiences the event every summer, when around 50 million crabs scuttle down from their homes to the beach to lay eggs.",POSITIVE,0.9922905564308167,0.9922905564308167
16,NewsNews,https://www.bbc.com/news/world/australia,NEGATIVE,0.12093145506722587,28,"Watch: Brits row from Peru to Australia in tiny boat Jess Rowe and Miriam Payne told the BBC how they made the six-month journey unsupported, catching fish and growing their own vegetables.",POSITIVE,0.9793168902397156,0.9793168902397156
16,NewsNews,https://www.bbc.com/news/world/australia,NEGATIVE,0.12093145506722587,28,"Watch: Dolphin calf rescued from fishing line entanglement The mother and calf were spotted in late September, with the young dolphin’s swimming ability noticeably impeded by a fishing line caught around its tail.",NEGATIVE,0.9962272644042969,-0.9962272644042969
16,NewsNews,https://www.bbc.com/news/world/australia,NEGATIVE,0.12093145506722587,28,"Latest updates 2 days ago 'Nestflix': Peregrine falcon livestream has Australians glued to their screens Fans of the birds, whose lives have been compared to Game of Thrones, are currently waiting with bated breath for this year's chicks to fledge.",POSITIVE,0.8565961122512817,0.8565961122512817
16,NewsNews,https://www.bbc.com/news/world/australia,NEGATIVE,0.12093145506722587,28,"2 days ago 3 days ago Man catches fire after power bank overheats at Melbourne airport lounge Staff helped the man, aged in his 50s, into a shower and he was treated for burns to his leg and fingers.",NEGATIVE,0.9929813146591187,-0.9929813146591187
16,NewsNews,https://www.bbc.com/news/world/australia,NEGATIVE,0.12093145506722587,28,"3 days ago 3 days ago Cummins 'on track' to return for second Ashes Test Australia captain Pat Cummins says he is ""on track"" to play the second Ashes Test against England as he recovers from a back injury.",POSITIVE,0.943066418170929,0.943066418170929
16,NewsNews,https://www.bbc.com/news/world/australia,NEGATIVE,0.12093145506722587,28,3 days ago 4 days ago Australian teen charged over allegedly sticking googly eyes on 'Blue Blob' artwork A local council said the repairs to the bright blue sculpture would be 'significant'.,NEGATIVE,0.9915655851364136,-0.9915655851364136
16,NewsNews,https://www.bbc.com/news/world/australia,NEGATIVE,0.12093145506722587,28,"4 days ago 4 days ago Great Barrier Reef may partially recover from 'grim future' if global warming stays below 2C A new study has found certain corals are more resilient in warmer waters, giving hope to the world-famous reef.",NEGATIVE,0.872317373752594,-0.872317373752594
16,NewsNews,https://www.bbc.com/news/world/australia,NEGATIVE,0.12093145506722587,28,"4 days ago 4 days ago 'Australia not a bunch of old-timers - they're an outstanding team' Australia's squad is older than England's and many are playing in their last Ashes, but they remain an outstanding team, says Stephan Shemilt.",POSITIVE,0.999710738658905,0.999710738658905
16,NewsNews,https://www.bbc.com/news/world/australia,NEGATIVE,0.12093145506722587,28,4 days ago 4 days ago Cruise ship that left woman to die on island boarded by investigators Officials from the Australian Maritime Safety Authority boarded the Coral Adventurer on Wednesday morning local time.,NEGATIVE,0.9697108864784241,-0.9697108864784241
16,NewsNews,https://www.bbc.com/news/world/australia,NEGATIVE,0.12093145506722587,28,4 days ago 4 days ago Who are the players in Australia's Ashes squad?,NEGATIVE,0.9963145852088928,-0.9963145852088928
16,NewsNews,https://www.bbc.com/news/world/australia,NEGATIVE,0.12093145506722587,28,BBC Sport profiles the players in Australia's squad for the opening Ashes Test against England.,POSITIVE,0.9937216639518738,0.9937216639518738
16,NewsNews,https://www.bbc.com/news/world/australia,NEGATIVE,0.12093145506722587,28,"4 days ago 4 days ago Only one player under 30 in Australia Ashes squad Australia chief selector George Bailey says the squad for the first Ashes Test against England deserves ""respect"".",POSITIVE,0.9664546847343445,0.9664546847343445
16,NewsNews,https://www.bbc.com/news/world/australia,NEGATIVE,0.12093145506722587,28,4 days ago 1 2 3 4 5 ... 12,NEGATIVE,0.9038671851158142,-0.9038671851158142
