article_index,title,url,avg_label,avg_score,num_sentences,sentence,sent_label,sent_score,sent_value
5,NewsNews,https://www.bbc.com/news/england,NEGATIVE,0.5099629651416432,44,2 hrs ago London Police chief guilty of contempt over arrest footage Three senior judges find Ivan Balhatchet personally liable after footage of an arrest is withheld.,NEGATIVE,0.9956070780754089,-0.9956070780754089
5,NewsNews,https://www.bbc.com/news/england,NEGATIVE,0.5099629651416432,44,"Royal outrider 'had no control' in fatal crash Helen Holland, 81, died two weeks after she was hit by a PC motorcyclist in west London, in May 2023.",NEGATIVE,0.9965457320213318,-0.9965457320213318
5,NewsNews,https://www.bbc.com/news/england,NEGATIVE,0.5099629651416432,44,Woman fined £1k for 'fly-tipping envelope' A woman was tracked down after she left an envelope on some fly-tipped rubbish when her bin was full.,NEGATIVE,0.9993646740913391,-0.9993646740913391
5,NewsNews,https://www.bbc.com/news/england,NEGATIVE,0.5099629651416432,44,"Family of bin lorry crash victim in 'disbelief' Andzie ""Stan"" Stanik died on Tuesday when a bin lorry struck a building in Leominster.",NEGATIVE,0.9978419542312622,-0.9978419542312622
5,NewsNews,https://www.bbc.com/news/england,NEGATIVE,0.5099629651416432,44,The hunt for the mystery man in a painting Artist Emma Prempeh wants to thank a man who inspired her latest work which is on display in Hull.,POSITIVE,0.996427595615387,0.996427595615387
5,NewsNews,https://www.bbc.com/news/england,NEGATIVE,0.5099629651416432,44,Stories to make you smile Man to shave off moustache after 50 years Rob Ewen from Okehampton first grew his moustache in 1975 and he will be shaving it off for charity.,POSITIVE,0.9261447787284851,0.9261447787284851
5,NewsNews,https://www.bbc.com/news/england,NEGATIVE,0.5099629651416432,44,Hillside chalk lion figure restored by volunteers The 147-metre-long lion is thought to be the largest hill figure in England.,POSITIVE,0.9919781684875488,0.9919781684875488
5,NewsNews,https://www.bbc.com/news/england,NEGATIVE,0.5099629651416432,44,First teen in years given highest cadet rank Arabella Mason is the first person chosen as a county's most senior cadet since before the pandemic.,POSITIVE,0.9368032217025757,0.9368032217025757
5,NewsNews,https://www.bbc.com/news/england,NEGATIVE,0.5099629651416432,44,Features & Analysis 'My rapist should be deported after his sentence' Abdelarahman Saleh Adam was convicted of rape in 2021 and sentenced to nine years in prison.,NEGATIVE,0.9987590312957764,-0.9987590312957764
5,NewsNews,https://www.bbc.com/news/england,NEGATIVE,0.5099629651416432,44,Why are landslides grinding routes to a halt?,NEGATIVE,0.9993240833282471,-0.9993240833282471
5,NewsNews,https://www.bbc.com/news/england,NEGATIVE,0.5099629651416432,44,The UK is experiencing major landslides but are they caused by extreme weather or something else?,NEGATIVE,0.9966366291046143,-0.9966366291046143
5,NewsNews,https://www.bbc.com/news/england,NEGATIVE,0.5099629651416432,44,"Businesses 'punished by last Budget' fearful for what's next Katya Milavic-Davies says last November's Budget was a ""kick in the teeth"" for small businesses.",NEGATIVE,0.9990670084953308,-0.9990670084953308
5,NewsNews,https://www.bbc.com/news/england,NEGATIVE,0.5099629651416432,44,Is UK's biggest solar farm a blueprint for future?,NEGATIVE,0.9954042434692383,-0.9954042434692383
5,NewsNews,https://www.bbc.com/news/england,NEGATIVE,0.5099629651416432,44,Cleve Hill is almost five times bigger than the next largest solar site in operation.,POSITIVE,0.9970791339874268,0.9970791339874268
5,NewsNews,https://www.bbc.com/news/england,NEGATIVE,0.5099629651416432,44,"The fight to save one of city's last rowing barges In the 1940s there were up to 26 barges, now only six remain, with a battle to keep some afloat.",NEGATIVE,0.9833077192306519,-0.9833077192306519
5,NewsNews,https://www.bbc.com/news/england,NEGATIVE,0.5099629651416432,44,Watch/Listen Watch as 1960s shopping centre demolished Rubble falls past an Anglia Square sign as heavy machinery begins to demolish the shopping precinct.,NEGATIVE,0.9994669556617737,-0.9994669556617737
5,NewsNews,https://www.bbc.com/news/england,NEGATIVE,0.5099629651416432,44,"2 hrs ago Norfolk Veteran turns plastic bottles into 2,500 poppies Chris Penrose transformed his home for Remembrance Sunday.",POSITIVE,0.9912384152412415,0.9912384152412415
5,NewsNews,https://www.bbc.com/news/england,NEGATIVE,0.5099629651416432,44,1 day ago Black Sabbath star auctions guitar for cancer unit Tony Iommi describes the shock of being diagnosed and treated for cancer.,NEGATIVE,0.9504356980323792,-0.9504356980323792
5,NewsNews,https://www.bbc.com/news/england,NEGATIVE,0.5099629651416432,44,1 day ago Olympic Park velodrome reflects 'fireworks as farts' Clips of the phenomenon have gone viral on social media after it was shared to TikTok.,NEGATIVE,0.9336798191070557,-0.9336798191070557
5,NewsNews,https://www.bbc.com/news/england,NEGATIVE,0.5099629651416432,44,1 day ago CCTV released over fireworks murder eight years on Police are urging people to examine their consciences.,NEGATIVE,0.9732791185379028,-0.9732791185379028
5,NewsNews,https://www.bbc.com/news/england,NEGATIVE,0.5099629651416432,44,1 day ago Sport Wolves appoint ex-defender Edwards as manager Wolves finally have their man.,POSITIVE,0.99552983045578,0.99552983045578
5,NewsNews,https://www.bbc.com/news/england,NEGATIVE,0.5099629651416432,44,Rob Edwards' appointment on a three-and-a-half-year contract follows the sacking of Vitor Pereira.,NEGATIVE,0.9973121881484985,-0.9973121881484985
5,NewsNews,https://www.bbc.com/news/england,NEGATIVE,0.5099629651416432,44,But how big of a gamble have the Premier League side made?,NEGATIVE,0.9954883456230164,-0.9954883456230164
5,NewsNews,https://www.bbc.com/news/england,NEGATIVE,0.5099629651416432,44,"Stokes defends England criticism from 'has-beens' Captain Ben Stokes dismisses criticism of England's limited Ashes preparation from ""has-beens"".",NEGATIVE,0.9875126481056213,-0.9875126481056213
5,NewsNews,https://www.bbc.com/news/england,NEGATIVE,0.5099629651416432,44,"'Salary cap would be legally challenged by clubs' A Premier League proposal to introduce a controversial salary cap ""cannot be imposed unilaterally"", says Professional Footballers' Association chief executive Maheta Molango.",POSITIVE,0.5369696617126465,0.5369696617126465
5,NewsNews,https://www.bbc.com/news/england,NEGATIVE,0.5099629651416432,44,How to stop the revolving door - what next for Southampton?,NEGATIVE,0.9991717338562012,-0.9991717338562012
5,NewsNews,https://www.bbc.com/news/england,NEGATIVE,0.5099629651416432,44,"Following the sacking of Will Still, who could be next in the dugout at St Mary's and what sort of situation are they stepping into?",NEGATIVE,0.9981297850608826,-0.9981297850608826
5,NewsNews,https://www.bbc.com/news/england,NEGATIVE,0.5099629651416432,44,Latest updates 49 mins ago Bearing plant closure plans a 'betrayal' to staff The company makes bearings for the automotive sector but plans to close its County Durham factories.,NEGATIVE,0.9992924928665161,-0.9992924928665161
5,NewsNews,https://www.bbc.com/news/england,NEGATIVE,0.5099629651416432,44,49 mins ago 2 hrs ago Police chief guilty of contempt over arrest footage Three senior judges find Ivan Balhatchet personally liable after footage of an arrest is withheld.,NEGATIVE,0.9925980567932129,-0.9925980567932129
5,NewsNews,https://www.bbc.com/news/england,NEGATIVE,0.5099629651416432,44,2 hrs ago 2 hrs ago Gunman who shot victim at point blank range jailed Leon Haughton from Wolverhampton shot his victim in a Dudley car park after tracking him.,NEGATIVE,0.9914181232452393,-0.9914181232452393
5,NewsNews,https://www.bbc.com/news/england,NEGATIVE,0.5099629651416432,44,2 hrs ago 2 hrs ago Council sees 'depressing' overspend on recycling The authority says money is being lost due to market fluctuations making recycling worth less.,NEGATIVE,0.9995861649513245,-0.9995861649513245
5,NewsNews,https://www.bbc.com/news/england,NEGATIVE,0.5099629651416432,44,2 hrs ago 2 hrs ago 'Bird flu means rare breeds will disappear' A mandatory housing order is in place across England following a rise in avian influenza.,NEGATIVE,0.9988861680030823,-0.9988861680030823
5,NewsNews,https://www.bbc.com/news/england,NEGATIVE,0.5099629651416432,44,2 hrs ago 2 hrs ago Detention centre guard a 'prolific sex offender' An inquiry catalogues missed opportunities to stop abuse at Medomsley Detention Centre.,NEGATIVE,0.9992465972900391,-0.9992465972900391
5,NewsNews,https://www.bbc.com/news/england,NEGATIVE,0.5099629651416432,44,"2 hrs ago 2 hrs ago Northern Lights dazzle across North West skies Greater Manchester, Lancashire and Merseyside were treated to a spectacular early hours display of the phenomenon.",POSITIVE,0.9993439316749573,0.9993439316749573
5,NewsNews,https://www.bbc.com/news/england,NEGATIVE,0.5099629651416432,44,"2 hrs ago 3 hrs ago Met Office issues yellow warning for heavy rain The Met Office warns there will be ""heavy and prolonged"" rain for 24 hours from 06:00 GMT on Friday.",NEGATIVE,0.993727445602417,-0.993727445602417
5,NewsNews,https://www.bbc.com/news/england,NEGATIVE,0.5099629651416432,44,"3 hrs ago 3 hrs ago Illegal goods worth £280k netted in city shop raids Officers visited 36 businesses across Peterborough and Whittlesey during the operation, say police.",NEGATIVE,0.985524594783783,-0.985524594783783
5,NewsNews,https://www.bbc.com/news/england,NEGATIVE,0.5099629651416432,44,3 hrs ago 1 2 3 4 5 ... 12,POSITIVE,0.7641292214393616,0.7641292214393616
6,NewsNews,https://www.bbc.com/news/northern_ireland,NEGATIVE,0.009438831359148026,48,News News N. Ireland N. Ireland Politics Schools could be named and shamed over unaffordable uniforms New uniform guidance to schools has been issued from the Department of Education.,NEGATIVE,0.9986774325370789,-0.9986774325370789
6,NewsNews,https://www.bbc.com/news/northern_ireland,NEGATIVE,0.009438831359148026,48,"1 hr ago Northern Ireland Student nurses to learn how to spot domestic abuse signs in UK first Almost 30,000 domestic abuse incidents were recorded  in Northern Ireland between June 2024 and 2025.",NEGATIVE,0.9313085675239563,-0.9313085675239563
6,NewsNews,https://www.bbc.com/news/northern_ireland,NEGATIVE,0.009438831359148026,48,"16 hrs ago Northern Ireland Woman found guilty of murdering two men in 2014 Two men were found shot dead on Inchicup Island on Lough Sheelin, in 2014, five weeks after they went missing.",NEGATIVE,0.9567351937294006,-0.9567351937294006
6,NewsNews,https://www.bbc.com/news/northern_ireland,NEGATIVE,0.009438831359148026,48,"7 mins ago Europe Northern Lights shine across Northern Ireland The Northern Lights, also known as the aurora borealis, are vibrant light displays that occur in the sky, usually near the polar regions.",POSITIVE,0.9996618032455444,0.9996618032455444
6,NewsNews,https://www.bbc.com/news/northern_ireland,NEGATIVE,0.009438831359148026,48,4 hrs ago Northern Ireland US tech firm's plans to create 100 new jobs The company has established a new office in Belfast and all the jobs will be filled over the next three years.,POSITIVE,0.9136743545532227,0.9136743545532227
6,NewsNews,https://www.bbc.com/news/northern_ireland,NEGATIVE,0.009438831359148026,48,5 hrs ago Northern Ireland Creating an ASMR soundscape for 330 million-year-old caves The Marble Arch Caves in County Fermanagh are one of several locations featured in a new campaign showcasing natural soundscapes from around NI.,POSITIVE,0.9957797527313232,0.9957797527313232
6,NewsNews,https://www.bbc.com/news/northern_ireland,NEGATIVE,0.009438831359148026,48,"9 hrs ago Northern Ireland Tribunal told woman's comments not seen as transphobic Sara Morrison, who worked for Belfast Film Festival, believes that people cannot change their biological sex.",NEGATIVE,0.8363856673240662,-0.8363856673240662
6,NewsNews,https://www.bbc.com/news/northern_ireland,NEGATIVE,0.009438831359148026,48,"2 hrs ago Northern Ireland Funeral of 20-year-old Irish man killed in Ukraine to take place Alex Ryzhuk, who was born in Dublin to Ukrainian parents, had been serving alongside military forces when he went missing and was presumed dead.",NEGATIVE,0.9372113943099976,-0.9372113943099976
6,NewsNews,https://www.bbc.com/news/northern_ireland,NEGATIVE,0.009438831359148026,48,Plastic still makes up the majority of waste on NI's beaches The latest Marine Litter Report from Keep Northern Ireland Beautiful records an average of 341 items of litter per 100m of beach.,NEGATIVE,0.9916270971298218,-0.9916270971298218
6,NewsNews,https://www.bbc.com/news/northern_ireland,NEGATIVE,0.009438831359148026,48,Ryanair scraps printed boarding passes to go fully digital The airline is only accepting digital boarding passes from Wednesday.,NEGATIVE,0.9988725781440735,-0.9988725781440735
6,NewsNews,https://www.bbc.com/news/northern_ireland,NEGATIVE,0.009438831359148026,48,Disclosure of Omagh bombing material an 'on-going process' The disclosure of material about the 1998 Omagh bombing remains an on-going process.,POSITIVE,0.9725995659828186,0.9725995659828186
6,NewsNews,https://www.bbc.com/news/northern_ireland,NEGATIVE,0.009438831359148026,48,BBC wins Royal Television Society NI awards BBC News NI has picked up awards at the Royal Television Society NI Awards at Titanic Belfast on Tuesday night.,POSITIVE,0.9922818541526794,0.9922818541526794
6,NewsNews,https://www.bbc.com/news/northern_ireland,NEGATIVE,0.009438831359148026,48,Features & Analysis Armistice Day marked across Northern Ireland Politicians and members of the public gather at memorials to commemorate fallen service personnel.,POSITIVE,0.9949933886528015,0.9949933886528015
6,NewsNews,https://www.bbc.com/news/northern_ireland,NEGATIVE,0.009438831359148026,48,"'I'm losing dozens of shop customers over traffic nightmare' People call for political help over congestion on the 16-mile (26km) stretch of road between Drumahoe, near Londonderry, and Dungiven.",NEGATIVE,0.9996492862701416,-0.9996492862701416
6,NewsNews,https://www.bbc.com/news/northern_ireland,NEGATIVE,0.009438831359148026,48,The hunt for the murdered British soldier who was determined to be noticed Captain Nairac was killed and secretly buried by the IRA almost 50 years ago.,NEGATIVE,0.9938313961029053,-0.9938313961029053
6,NewsNews,https://www.bbc.com/news/northern_ireland,NEGATIVE,0.009438831359148026,48,'I didn't feel safe after race hate attack on my shop - but I'm glad I stayed' A businessman who considered leaving Belfast after a racist attack is back in business in another part of the city.,POSITIVE,0.9899718761444092,0.9899718761444092
6,NewsNews,https://www.bbc.com/news/northern_ireland,NEGATIVE,0.009438831359148026,48,BBC Newsline signed summary A signed summary of BBC Newsline.,NEGATIVE,0.9771750569343567,-0.9771750569343567
6,NewsNews,https://www.bbc.com/news/northern_ireland,NEGATIVE,0.009438831359148026,48,"Foyle & West Remembrance poppy memorial thefts treated as sectarian hate crime The items, commemorating people from the area who died in World War One, were stolen from the Fountain estate on Remembrance weekend.",NEGATIVE,0.9959232807159424,-0.9959232807159424
6,NewsNews,https://www.bbc.com/news/northern_ireland,NEGATIVE,0.009438831359148026,48,"Calls for investigation after assaults at youth Gaelic football match Tyrone GAA says it is treating the matter ""most seriously"" as police appeal for information.",NEGATIVE,0.9821773767471313,-0.9821773767471313
6,NewsNews,https://www.bbc.com/news/northern_ireland,NEGATIVE,0.009438831359148026,48,"Child critical after serious crash involving lorry Emergency services were called to the scene on the Boleran Road, between Coleraine, Limavady and Garvagh, shortly before 16:00 BST on Monday.",NEGATIVE,0.9960112571716309,-0.9960112571716309
6,NewsNews,https://www.bbc.com/news/northern_ireland,NEGATIVE,0.009438831359148026,48,Two men injured in suspected homophobic attack The men had made their way onto Derry's Peace Bridge on Saturday night when they were assaulted.,NEGATIVE,0.9829561710357666,-0.9829561710357666
6,NewsNews,https://www.bbc.com/news/northern_ireland,NEGATIVE,0.009438831359148026,48,"Listen: North West Today A round-up of local news, sport and weather across the north west of Northern Ireland.",POSITIVE,0.9958023428916931,0.9958023428916931
6,NewsNews,https://www.bbc.com/news/northern_ireland,NEGATIVE,0.009438831359148026,48,"Republic of Ireland Catherine Connolly becomes 10th president of Ireland The Republic of Ireland's new president says ""our actions today will shape the world our grandchildren will inherit"".",POSITIVE,0.9995841383934021,0.9995841383934021
6,NewsNews,https://www.bbc.com/news/northern_ireland,NEGATIVE,0.009438831359148026,48,"Outgoing Irish president proved he was no pushover As Michael D Higgins ends his 14-year stretch as Ireland's president, Enda McClafferty looks back at his defining moments.",POSITIVE,0.9978196620941162,0.9978196620941162
6,NewsNews,https://www.bbc.com/news/northern_ireland,NEGATIVE,0.009438831359148026,48,Higgins leaves official residence on last day as Irish president There were cheers as Michael D and Sabina Higgins left Áras an Uachtaráin which is located in Dublin's Phoenix Park.,POSITIVE,0.9605915546417236,0.9605915546417236
6,NewsNews,https://www.bbc.com/news/northern_ireland,NEGATIVE,0.009438831359148026,48,"Bird flu outbreak confirmed near Northern Ireland border The Republic of Ireland's minister for agriculture, food and the marine confirms a further outbreak of highly pathogenic avian influenza H5N1.",NEGATIVE,0.935537576675415,-0.935537576675415
6,NewsNews,https://www.bbc.com/news/northern_ireland,NEGATIVE,0.009438831359148026,48,DUP absence from Connolly inauguration 'not a snub' Gavin Robinson was speaking after the party confirmed they would not send a representative to Catherine Connolly's inauguration on Tuesday.,NEGATIVE,0.9989481568336487,-0.9989481568336487
6,NewsNews,https://www.bbc.com/news/northern_ireland,NEGATIVE,0.009438831359148026,48,More BBC News NI on iPlayer & Sounds Good Morning Ulster Wake up to Good Morning Ulster and get all the news and analysis from home and abroad.,POSITIVE,0.9683663249015808,0.9683663249015808
6,NewsNews,https://www.bbc.com/news/northern_ireland,NEGATIVE,0.009438831359148026,48,The Nolan Show Breaking news and hard-hitting talk about the big stories of the day.,POSITIVE,0.9997394680976868,0.9997394680976868
6,NewsNews,https://www.bbc.com/news/northern_ireland,NEGATIVE,0.009438831359148026,48,Talkback Highlights from Talkback.,POSITIVE,0.976185142993927,0.976185142993927
6,NewsNews,https://www.bbc.com/news/northern_ireland,NEGATIVE,0.009438831359148026,48,William Crawley and guests discuss the news headlines.,POSITIVE,0.9976305961608887,0.9976305961608887
6,NewsNews,https://www.bbc.com/news/northern_ireland,NEGATIVE,0.009438831359148026,48,Evening Extra All the day’s news and analysis with Richard Morgan.,POSITIVE,0.9880174398422241,0.9880174398422241
6,NewsNews,https://www.bbc.com/news/northern_ireland,NEGATIVE,0.009438831359148026,48,BBC Newsline The latest news for Northern Ireland.,POSITIVE,0.9590707421302795,0.9590707421302795
6,NewsNews,https://www.bbc.com/news/northern_ireland,NEGATIVE,0.009438831359148026,48,The State of Us Tara Mills and Declan Harvey react and reflect on news stories in a BBC NI podcast.,NEGATIVE,0.8977723717689514,-0.8977723717689514
6,NewsNews,https://www.bbc.com/news/northern_ireland,NEGATIVE,0.009438831359148026,48,Red Lines The back-stop’s here?,NEGATIVE,0.9966791868209839,-0.9966791868209839
6,NewsNews,https://www.bbc.com/news/northern_ireland,NEGATIVE,0.009438831359148026,48,Bad puns with top political coverage from BBC Northern Ireland.,NEGATIVE,0.9947400689125061,-0.9947400689125061
6,NewsNews,https://www.bbc.com/news/northern_ireland,NEGATIVE,0.009438831359148026,48,The View Mark Carruthers provides comment and expert analysis on the week's political news Spotlight Hard-hitting investigations on the stories that matter in Northern Ireland.,POSITIVE,0.999180257320404,0.999180257320404
6,NewsNews,https://www.bbc.com/news/northern_ireland,NEGATIVE,0.009438831359148026,48,"Sunday Politics Northern Ireland Mark Carruthers with the latest political news, interviews and debate.",POSITIVE,0.9979939460754395,0.9979939460754395
6,NewsNews,https://www.bbc.com/news/northern_ireland,NEGATIVE,0.009438831359148026,48,Latest updates 1 hr ago Schools could be named and shamed over unaffordable uniforms New uniform guidance to schools has been issued from the Department of Education.,NEGATIVE,0.9987504482269287,-0.9987504482269287
6,NewsNews,https://www.bbc.com/news/northern_ireland,NEGATIVE,0.009438831359148026,48,"1 hr ago 2 hrs ago Tribunal told woman's comments not seen as transphobic Sara Morrison, who worked for Belfast Film Festival, believes that people cannot change their biological sex.",NEGATIVE,0.9280558824539185,-0.9280558824539185
6,NewsNews,https://www.bbc.com/news/northern_ireland,NEGATIVE,0.009438831359148026,48,2 hrs ago 3 hrs ago Disclosure of Omagh bombing material an 'on-going process' The disclosure of material about the 1998 Omagh bombing remains an on-going process.,POSITIVE,0.6250954866409302,0.6250954866409302
6,NewsNews,https://www.bbc.com/news/northern_ireland,NEGATIVE,0.009438831359148026,48,"3 hrs ago 4 hrs ago Northern Lights shine across Northern Ireland The Northern Lights, also known as the aurora borealis, are vibrant light displays that occur in the sky, usually near the polar regions.",POSITIVE,0.9997337460517883,0.9997337460517883
6,NewsNews,https://www.bbc.com/news/northern_ireland,NEGATIVE,0.009438831359148026,48,4 hrs ago 5 hrs ago Teenager arrested after banner stolen from poppy memorial A 16 year old has been bailed following a theft from a poppy memorial display in the Fountain area.,NEGATIVE,0.9920870661735535,-0.9920870661735535
6,NewsNews,https://www.bbc.com/news/northern_ireland,NEGATIVE,0.009438831359148026,48,5 hrs ago 5 hrs ago US tech firm's plans to create 100 new jobs The company has established a new office in Belfast and all the jobs will be filled over the next three years.,POSITIVE,0.7285763025283813,0.7285763025283813
6,NewsNews,https://www.bbc.com/news/northern_ireland,NEGATIVE,0.009438831359148026,48,5 hrs ago 9 hrs ago Creating an ASMR soundscape for 330 million-year-old caves The Marble Arch Caves in County Fermanagh are one of several locations featured in a new campaign showcasing natural soundscapes from around NI.,POSITIVE,0.9921417236328125,0.9921417236328125
6,NewsNews,https://www.bbc.com/news/northern_ireland,NEGATIVE,0.009438831359148026,48,9 hrs ago 9 hrs ago Plastic still makes up the majority of waste on NI's beaches The latest Marine Litter Report from Keep Northern Ireland Beautiful records an average of 341 items of litter per 100m of beach.,NEGATIVE,0.9910004734992981,-0.9910004734992981
6,NewsNews,https://www.bbc.com/news/northern_ireland,NEGATIVE,0.009438831359148026,48,"9 hrs ago 16 hrs ago Student nurses to learn how to spot domestic abuse signs in UK first Almost 30,000 domestic abuse incidents were recorded  in Northern Ireland between June 2024 and 2025.",NEGATIVE,0.9430704712867737,-0.9430704712867737
6,NewsNews,https://www.bbc.com/news/northern_ireland,NEGATIVE,0.009438831359148026,48,16 hrs ago 1 2 3 4 5 ... 12,POSITIVE,0.7576280832290649,0.7576280832290649
7,NewsNews,https://www.bbc.com/news/northern_ireland/northern_ireland_politics,NEGATIVE,0.8126547634601593,12,News News N. Ireland N. Ireland Politics DUP absence from Connolly inauguration 'not a snub' Gavin Robinson was speaking after the party confirmed they would not send a representative to Catherine Connolly's inauguration on Tuesday.,NEGATIVE,0.9985650181770325,-0.9985650181770325
7,NewsNews,https://www.bbc.com/news/northern_ireland/northern_ireland_politics,NEGATIVE,0.8126547634601593,12,2 days ago Northern Ireland Politics Bid to oust education minister from office over Israel visit fails The move was set to fail as it needed cross-community support and unionist parties had already ruled out supporting it.,NEGATIVE,0.9997051358222961,-0.9997051358222961
7,NewsNews,https://www.bbc.com/news/northern_ireland/northern_ireland_politics,NEGATIVE,0.8126547634601593,12,"2 days ago Northern Ireland Politics Backdated health workers' pay award to go ahead, says minister A pay offer aimed at avoiding industrial action by healthcare workers has been made by the Department of Health.",NEGATIVE,0.9919741749763489,-0.9919741749763489
7,NewsNews,https://www.bbc.com/news/northern_ireland/northern_ireland_politics,NEGATIVE,0.8126547634601593,12,"6 days ago Northern Ireland 'Sinister attack' on Alliance headquarters 'tried to incite fear' It was reported on Wednesday that graffiti had been sprayed onto external windows, door shutters and a fence.",NEGATIVE,0.9984340071678162,-0.9984340071678162
7,NewsNews,https://www.bbc.com/news/northern_ireland/northern_ireland_politics,NEGATIVE,0.8126547634601593,12,6 days ago Northern Ireland DUP will not be represented at Irish presidential inauguration Alliance MLA Paula Bradshaw says the DUP should send an alternative representative to Deputy First Minister Emma Little-Pengelly.,NEGATIVE,0.9964757561683655,-0.9964757561683655
7,NewsNews,https://www.bbc.com/news/northern_ireland/northern_ireland_politics,NEGATIVE,0.8126547634601593,12,3 days ago Northern Ireland Politics Little-Pengelly turns down Irish presidential inauguration invite Northern Ireland's deputy first minister says she is unable to attend Catherine Connolly's inauguration due to Remembrance Day commitments.,NEGATIVE,0.9980236291885376,-0.9980236291885376
