article_index,title,url,avg_label,avg_score,num_sentences,sentence,sent_label,sent_score,sent_value
7,NewsNews,https://www.bbc.com/news/northern_ireland/northern_ireland_politics,NEGATIVE,0.8126547634601593,12,"5 days ago Northern Ireland Politics PSNI pay deal possible before end of year, says Long The justice minister was speaking after the health minister announced he has been given approval to award pay parity to healthcare workers.",NEGATIVE,0.9924170970916748,-0.9924170970916748
7,NewsNews,https://www.bbc.com/news/northern_ireland/northern_ireland_politics,NEGATIVE,0.8126547634601593,12,"5 days ago Northern Ireland Politics Stormont choices 'may add to funding pressures', says Benn Hilary Benn refused to be drawn on whether the Budget later this month would involve tax rises.",NEGATIVE,0.9972896575927734,-0.9972896575927734
7,NewsNews,https://www.bbc.com/news/northern_ireland/northern_ireland_politics,NEGATIVE,0.8126547634601593,12,"Guidance for businesses on NI's post-Brexit trade deal 'not fit for purpose' The panel said information was ""poorly presented, unwieldy and needs to be significantly improved"".",NEGATIVE,0.9997584223747253,-0.9997584223747253
7,NewsNews,https://www.bbc.com/news/northern_ireland/northern_ireland_politics,NEGATIVE,0.8126547634601593,12,"MLAs told cooperation over environment agency is 'crucial' Andrew Muir says assembly members should ""put their money where their mouth is"" and support the plan for an independent environment agency.",NEGATIVE,0.5629351139068604,-0.5629351139068604
7,NewsNews,https://www.bbc.com/news/northern_ireland/northern_ireland_politics,NEGATIVE,0.8126547634601593,12,"Any tax increase must be 'fair and progressive' UK Chancellor Rachel Reeves refuses to rule out rises, saying she will make the ""necessary choices"".",POSITIVE,0.7782537937164307,0.7782537937164307
7,NewsNews,https://www.bbc.com/news/northern_ireland/northern_ireland_politics,NEGATIVE,0.8126547634601593,12,"Israel trip given 'clean bill of health', minister says Stormont's Education Minister Paul Givan continues to face criticism over his six-day tour of Israel.",NEGATIVE,0.9945329427719116,-0.9945329427719116
8,NewsNews,https://www.bbc.com/news/scotland,NEGATIVE,0.21184509857134384,44,News News Scotland Scotland Politics Judges say Scottish courts are risking right to fair trial in sex cases The landmark ruling by the UK Supreme Court could trigger multiple legal challenges by men convicted of sexual offences.,NEGATIVE,0.9676471948623657,-0.9676471948623657
8,NewsNews,https://www.bbc.com/news/scotland,NEGATIVE,0.21184509857134384,44,"31 mins ago Scotland Plans to demolish Netflix's Dept Q police headquarters Argyle House starred as the police headquarters in the Netflix series, but it could be demolished for a new development.",NEGATIVE,0.9993302822113037,-0.9993302822113037
8,NewsNews,https://www.bbc.com/news/scotland,NEGATIVE,0.21184509857134384,44,"2 hrs ago Edinburgh, Fife & East Roseburn Path: What is the row over a new Edinburgh tram line about?",NEGATIVE,0.9949342608451843,-0.9949342608451843
8,NewsNews,https://www.bbc.com/news/scotland,NEGATIVE,0.21184509857134384,44,A public consultation on plans to build a new tram line along a popular cycle route closes on Monday.,NEGATIVE,0.9865167140960693,-0.9865167140960693
8,NewsNews,https://www.bbc.com/news/scotland,NEGATIVE,0.21184509857134384,44,"10 hrs ago Edinburgh, Fife & East Three arrested after missing man found dead in field Police confirmed the body of a 50-year-old man, who was reported missing, was found in a field in Kilmacolm.",NEGATIVE,0.9803354740142822,-0.9803354740142822
8,NewsNews,https://www.bbc.com/news/scotland,NEGATIVE,0.21184509857134384,44,"21 hrs ago Glasgow & West Scotland Nursery pays out £10,000 after toddler breaks leg on first day Skye Tucker fell from a nappy changing table at Little Clouds Nursery in Altens, Aberdeen, in January this year.",NEGATIVE,0.9715285897254944,-0.9715285897254944
8,NewsNews,https://www.bbc.com/news/scotland,NEGATIVE,0.21184509857134384,44,"53 mins ago NE, Orkney & Shetland Police chief says force will always record rapists as men Police Scotland has clarified its policy on how rapes and attempted rapes are registered on its system.",POSITIVE,0.6170633435249329,0.6170633435249329
8,NewsNews,https://www.bbc.com/news/scotland,NEGATIVE,0.21184509857134384,44,"2 hrs ago Scotland Politics Outcry over plans to park wind farm parts in Highland beauty spot The developer says the project is at the early stages, but communities are already worries about impacts.",NEGATIVE,0.9783543944358826,-0.9783543944358826
8,NewsNews,https://www.bbc.com/news/scotland,NEGATIVE,0.21184509857134384,44,5 hrs ago Scotland Why Scotland's teachers want 90 minutes back Scotland's teachers are preparing to vote on industrial action over workload and time spent in front of pupils.,NEGATIVE,0.9960933327674866,-0.9960933327674866
8,NewsNews,https://www.bbc.com/news/scotland,NEGATIVE,0.21184509857134384,44,Doubt over future of Aberdeen's Pride parade after 'rise in abuse' The organisers of the Aberdeen event say they want to focus on supporting people targeted in hate incidents.,NEGATIVE,0.9942247271537781,-0.9942247271537781
8,NewsNews,https://www.bbc.com/news/scotland,NEGATIVE,0.21184509857134384,44,Northern Lights set to dazzle UK once again tonight The Northern Lights have been shining over the UK and there is another chance to see them Wednesday as Elizabeth Rizzini and Helen Willetts explain.,POSITIVE,0.9982938170433044,0.9982938170433044
8,NewsNews,https://www.bbc.com/news/scotland,NEGATIVE,0.21184509857134384,44,Police investigation after rape in Glasgow city centre Emergency services were called to Sauchiehall Lane about 03:10.,NEGATIVE,0.9272966384887695,-0.9272966384887695
8,NewsNews,https://www.bbc.com/news/scotland,NEGATIVE,0.21184509857134384,44,Two in hospital after crash which shut motorway for hours Two men were hurt in the crash which shut the A74(M) near Johnstonebridge in southern Scotland.,NEGATIVE,0.9899433851242065,-0.9899433851242065
8,NewsNews,https://www.bbc.com/news/scotland,NEGATIVE,0.21184509857134384,44,Features and analysis Battle of the taxes Rachel Reeves’s Budget and the two-child benefit cap.,POSITIVE,0.980880856513977,0.980880856513977
8,NewsNews,https://www.bbc.com/news/scotland,NEGATIVE,0.21184509857134384,44,Game designers bring Scotland's mysterious Picts to life Writers and archaeologists also worked on a new guide to a lost early medieval Scottish society.,POSITIVE,0.9991539716720581,0.9991539716720581
8,NewsNews,https://www.bbc.com/news/scotland,NEGATIVE,0.21184509857134384,44,"The WW1 piper who marched through gas, bullets and bombs to save his regiment Daniel Laidlaw was awarded the Victoria Cross for his bravery in the face of battle.",POSITIVE,0.9961656332015991,0.9961656332015991
8,NewsNews,https://www.bbc.com/news/scotland,NEGATIVE,0.21184509857134384,44,"I had to change my degree because of university cuts Students say they are feeling the effects across studios, classrooms and workshops.",NEGATIVE,0.9987817406654358,-0.9987817406654358
8,NewsNews,https://www.bbc.com/news/scotland,NEGATIVE,0.21184509857134384,44,Your pictures of Scotland A selection of photographs submitted to BBC Scotland News from around the country this week.,POSITIVE,0.9970200657844543,0.9970200657844543
8,NewsNews,https://www.bbc.com/news/scotland,NEGATIVE,0.21184509857134384,44,News from around Scotland Pedestrian in hospital after being hit by double-decker bus The man was struck by a Lothian Buses vehicle near Haymarket station in Edinburgh.,NEGATIVE,0.9974424839019775,-0.9974424839019775
8,NewsNews,https://www.bbc.com/news/scotland,NEGATIVE,0.21184509857134384,44,"Outcry over plans to park wind farm parts in Highland beauty spot The developer says the project is at the early stages, but communities are already worries about impacts.",NEGATIVE,0.9815094470977783,-0.9815094470977783
8,NewsNews,https://www.bbc.com/news/scotland,NEGATIVE,0.21184509857134384,44,Doubt over future of Aberdeen's Pride parade after 'rise in abuse' The organisers of the Aberdeen event say they want to focus on supporting people targeted in hate incidents.,NEGATIVE,0.9942247271537781,-0.9942247271537781
8,NewsNews,https://www.bbc.com/news/scotland,NEGATIVE,0.21184509857134384,44,Fire-hit school's £61m replacement opens its doors The new facility in Peebles was built at a cost of £61m after the old one was badly damaged.,NEGATIVE,0.9830353260040283,-0.9830353260040283
8,NewsNews,https://www.bbc.com/news/scotland,NEGATIVE,0.21184509857134384,44,Teenage driver cleared of causing deaths of his best friends Jayden McConnell and Kyle Marshall died in the car driven by Charles Gray when it crashed near Stirling.,NEGATIVE,0.9950023293495178,-0.9950023293495178
8,NewsNews,https://www.bbc.com/news/scotland,NEGATIVE,0.21184509857134384,44,Sport How does Clarke rouse Scotland for tenure-defining games?,NEGATIVE,0.9938540458679199,-0.9938540458679199
8,NewsNews,https://www.bbc.com/news/scotland,NEGATIVE,0.21184509857134384,44,"The next four days could define Steve Clarke's Scotland reign, so how can he inspire his team for a seismic World Cup qualifying double-header?",NEGATIVE,0.5136902928352356,-0.5136902928352356
8,NewsNews,https://www.bbc.com/news/scotland,NEGATIVE,0.21184509857134384,44,'Mad scientist' & 'next Luis Enrique' - who is Celtic-linked Wilfried Nancy?,POSITIVE,0.9074305891990662,0.9074305891990662
8,NewsNews,https://www.bbc.com/news/scotland,NEGATIVE,0.21184509857134384,44,"Kheredine Idessane speaks to an MLS expert about Columbus Crew head coach Wilfried Nancy, who has been linked with Celtic.",POSITIVE,0.994785487651825,0.994785487651825
8,NewsNews,https://www.bbc.com/news/scotland,NEGATIVE,0.21184509857134384,44,"Foley sells Hibs stake back to Gordon family American businessman Bill Foley has sold his 25% stake in Hibernian back to the club's majority shareholder, the Gordon family, after the pair agreed the partnership was not working.",NEGATIVE,0.992061972618103,-0.992061972618103
8,NewsNews,https://www.bbc.com/news/scotland,NEGATIVE,0.21184509857134384,44,First Scotland call up for Aston Villa's Taylor Aston Villa midfielder Miri Taylor gets her maiden Scotland call up after changing her international allegiance from England earlier this month.,POSITIVE,0.9965581297874451,0.9965581297874451
8,NewsNews,https://www.bbc.com/news/scotland,NEGATIVE,0.21184509857134384,44,You are Scotland boss Steve Clarke… What would you do?,POSITIVE,0.9957035183906555,0.9957035183906555
8,NewsNews,https://www.bbc.com/news/scotland,NEGATIVE,0.21184509857134384,44,Put yourself in the shoes of the Scotland manager and pick the side and tactics and decide what your pre-match team talk would be.,POSITIVE,0.9970918893814087,0.9970918893814087
8,NewsNews,https://www.bbc.com/news/scotland,NEGATIVE,0.21184509857134384,44,More news on iPlayer and Sounds Reporting Scotland Big stories from across the country Scotcast The BBC's Scottish news podcast.,NEGATIVE,0.9620128870010376,-0.9620128870010376
8,NewsNews,https://www.bbc.com/news/scotland,NEGATIVE,0.21184509857134384,44,Reporting Scotland: News at Seven More from the day’s top stories and communities across Scotland.,POSITIVE,0.9981580376625061,0.9981580376625061
8,NewsNews,https://www.bbc.com/news/scotland,NEGATIVE,0.21184509857134384,44,Good Morning Scotland The nation's morning news programme.,POSITIVE,0.9996204376220703,0.9996204376220703
8,NewsNews,https://www.bbc.com/news/scotland,NEGATIVE,0.21184509857134384,44,Latest updates 31 mins ago Judges say Scottish courts are risking right to fair trial in sex cases The landmark ruling by the UK Supreme Court could trigger multiple legal challenges by men convicted of sexual offences.,NEGATIVE,0.9693701863288879,-0.9693701863288879
8,NewsNews,https://www.bbc.com/news/scotland,NEGATIVE,0.21184509857134384,44,"31 mins ago 5 hrs ago Outcry over plans to park wind farm parts in Highland beauty spot The developer says the project is at the early stages, but communities are already worries about impacts.",NEGATIVE,0.9803244471549988,-0.9803244471549988
8,NewsNews,https://www.bbc.com/news/scotland,NEGATIVE,0.21184509857134384,44,5 hrs ago 9 hrs ago Scotland's papers: Pensions U-turn call and benefit claims rise A review of the front page stories from the daily newspapers in Scotland.,POSITIVE,0.9427490830421448,0.9427490830421448
8,NewsNews,https://www.bbc.com/news/scotland,NEGATIVE,0.21184509857134384,44,9 hrs ago 10 hrs ago Game designers bring Scotland's mysterious Picts to life Writers and archaeologists also worked on a new guide to a lost early medieval Scottish society.,POSITIVE,0.9964214563369751,0.9964214563369751
8,NewsNews,https://www.bbc.com/news/scotland,NEGATIVE,0.21184509857134384,44,10 hrs ago 23 hrs ago Jail for ex-footballer 'wealthy' from drugs trade The former Highland League player was sentenced along with five other members of a drugs gang.,NEGATIVE,0.9802764654159546,-0.9802764654159546
8,NewsNews,https://www.bbc.com/news/scotland,NEGATIVE,0.21184509857134384,44,23 hrs ago 23 hrs ago First steps in bid to close Scotland's smallest secondary A council starts the preliminary process which could pave the way for Dalry Secondary to shut.,NEGATIVE,0.9938872456550598,-0.9938872456550598
8,NewsNews,https://www.bbc.com/news/scotland,NEGATIVE,0.21184509857134384,44,23 hrs ago 1 day ago Scotland wait on Russell as Hurd & Bhatti join up Star fly-half Finn Russell remains with the Scotland squad for Sunday's Test against Argentina at Murrayfield despite knee and ankle problems in the weekend loss to New Zealand.,POSITIVE,0.9522022008895874,0.9522022008895874
8,NewsNews,https://www.bbc.com/news/scotland,NEGATIVE,0.21184509857134384,44,"1 day ago 1 day ago Scotland remembers the fallen on Armistice Day Across Scotland, people have fallen silent to pay tribute to those who have lost their lives in conflicts around the world.",POSITIVE,0.9335589408874512,0.9335589408874512
8,NewsNews,https://www.bbc.com/news/scotland,NEGATIVE,0.21184509857134384,44,1 day ago 1 day ago Scotland's papers: Trump threatens to sue BBC and ferry fleet struggles A review of the front page stories from the daily newspapers in Scotland.,NEGATIVE,0.9921849370002747,-0.9921849370002747
8,NewsNews,https://www.bbc.com/news/scotland,NEGATIVE,0.21184509857134384,44,1 day ago 1 2 3 4 5 ... 11,NEGATIVE,0.51017826795578,-0.51017826795578
9,NewsNews,https://www.bbc.com/news/scotland/scotland_politics,NEGATIVE,0.5141184396213956,18,News News Scotland Scotland Politics Police chief says force will always record rapists as men Police Scotland has clarified its policy on how rapes and attempted rapes are registered on its system.,POSITIVE,0.9069097638130188,0.9069097638130188
9,NewsNews,https://www.bbc.com/news/scotland/scotland_politics,NEGATIVE,0.5141184396213956,18,2 hrs ago Scotland Politics Why Scotland's teachers want 90 minutes back Scotland's teachers are preparing to vote on industrial action over workload and time spent in front of pupils.,NEGATIVE,0.9950939416885376,-0.9950939416885376
9,NewsNews,https://www.bbc.com/news/scotland/scotland_politics,NEGATIVE,0.5141184396213956,18,10 hrs ago Scotland Politics Sarwar refuses to comment on UK tax hike speculation Chancellor Rachel Reeves has fuelled speculation that she could announce an increase in the Autumn Budget.,NEGATIVE,0.9814326167106628,-0.9814326167106628
9,NewsNews,https://www.bbc.com/news/scotland/scotland_politics,NEGATIVE,0.5141184396213956,18,2 days ago Scotland Politics SNP take over running of Stirling Council An agreement has also been reached that sees the first Scottish Green join the administration.,POSITIVE,0.998117208480835,0.998117208480835
9,NewsNews,https://www.bbc.com/news/scotland/scotland_politics,NEGATIVE,0.5141184396213956,18,"2 days ago Tayside & Central Scotland Early release of prisoners will cause victims anxiety, admits minister The emergency scheme which will see nearly 1,000 inmates freed from Scotland's jails is set to get under way.",NEGATIVE,0.9971838593482971,-0.9971838593482971
9,NewsNews,https://www.bbc.com/news/scotland/scotland_politics,NEGATIVE,0.5141184396213956,18,23 hrs ago Scotland Politics Minimum age in assisted dying bill raised to 18 MSPs on Holyrood's health committee have backed an amendment to raise the lower threshold from 16.,NEGATIVE,0.7542201280593872,-0.7542201280593872
9,NewsNews,https://www.bbc.com/news/scotland/scotland_politics,NEGATIVE,0.5141184396213956,18,"1 day ago Scotland Politics Breastfeeding rates in Scotland at record high Breastfeeding rates in Scotland are at the highest level since official records began, Public Health Scotland (PHS) data shows.",POSITIVE,0.9878822565078735,0.9878822565078735
9,NewsNews,https://www.bbc.com/news/scotland/scotland_politics,NEGATIVE,0.5141184396213956,18,1 day ago Scotland Politics Finance secretary may have to 'revisit' no tax rise pledge Shona Robison says the chancellor's Budget decisions later this month could put unforeseen pressure on Scotland's finances.,NEGATIVE,0.9985673427581787,-0.9985673427581787
9,NewsNews,https://www.bbc.com/news/scotland/scotland_politics,NEGATIVE,0.5141184396213956,18,"Alex Salmond died with debts of more than £340,000 Insolvency firm Begbies Traynor has named a trustee in sequestration to handle the former first minister's estate.",NEGATIVE,0.9114512205123901,-0.9114512205123901
9,NewsNews,https://www.bbc.com/news/scotland/scotland_politics,NEGATIVE,0.5141184396213956,18,How Scottish parties will try to maximise election votes in six months Opinion polls point to a fifth SNP victory - but a lot could change in six months with parties working flat out for votes.,NEGATIVE,0.9902778267860413,-0.9902778267860413
9,NewsNews,https://www.bbc.com/news/scotland/scotland_politics,NEGATIVE,0.5141184396213956,18,Whip restored to suspended Labour MP Leishman Alloa and Grangemouth MP Brian Leishman is returning to the Labour benches after a four-month suspension.,NEGATIVE,0.6058455109596252,-0.6058455109596252
9,NewsNews,https://www.bbc.com/news/scotland/scotland_politics,NEGATIVE,0.5141184396213956,18,Scottish government reveals plan to reach net zero targets by 2045 The route map includes targets to decarbonise building heat systems and phase out new petrol and diesel cars.,NEGATIVE,0.9872482419013977,-0.9872482419013977
9,NewsNews,https://www.bbc.com/news/scotland/scotland_politics,NEGATIVE,0.5141184396213956,18,Features and analysis Why the battle still rages over land ownership in Scotland The reaction to the Scottish government's wide-ranging new laws show the divided opinions on the issue.,POSITIVE,0.9864600896835327,0.9864600896835327
9,NewsNews,https://www.bbc.com/news/scotland/scotland_politics,NEGATIVE,0.5141184396213956,18,"Mental health, buses and school meals - issues that matter to first-time voters Teenagers who could vote for the first time next year put politicians through their paces at an event in Dumfries.",NEGATIVE,0.9702868461608887,-0.9702868461608887
9,NewsNews,https://www.bbc.com/news/scotland/scotland_politics,NEGATIVE,0.5141184396213956,18,"Sabotage, betrayal, secrecy... and recycling How a £50m court case over Scotland's deposit return scheme turned into a political blockbuster.",NEGATIVE,0.9919211864471436,-0.9919211864471436
9,NewsNews,https://www.bbc.com/news/scotland/scotland_politics,NEGATIVE,0.5141184396213956,18,"A bridge, 130 convictions and a 30-year fight: The tolls that made criminals of islanders More than 100 people received criminal convictions after refusing to pay tolls on the Skye Bridge.",NEGATIVE,0.9545219540596008,-0.9545219540596008
9,NewsNews,https://www.bbc.com/news/scotland/scotland_politics,NEGATIVE,0.5141184396213956,18,Why is the government being sued for £170m over a recycling scheme?,NEGATIVE,0.9983195662498474,-0.9983195662498474
9,NewsNews,https://www.bbc.com/news/scotland/scotland_politics,NEGATIVE,0.5141184396213956,18,A waste management firm has launched legal action over a beleaguered bottle return plan.,NEGATIVE,0.9971309900283813,-0.9971309900283813
10,NewsNews,https://www.bbc.com/news/wales,NEGATIVE,0.2519369277843209,43,"News News Wales Wales Politics Reform politician faces suspension over WhatsApp racial slur Laura Anne Jones used a racial slur to describe Chinese people, in August 2023, in a WhatsApp chat.",NEGATIVE,0.9968795776367188,-0.9968795776367188
10,NewsNews,https://www.bbc.com/news/wales,NEGATIVE,0.2519369277843209,43,"2 hrs ago Wales 'No warning signs' on beach where dad and son drowned The dad and son, from Blackwood in Caerphilly county, were swept out to sea while on holiday, an inquest hears.",NEGATIVE,0.9452016353607178,-0.9452016353607178
10,NewsNews,https://www.bbc.com/news/wales,NEGATIVE,0.2519369277843209,43,3 hrs ago Wales Northern Lights leave sky-gazers in awe A powerful solar storm allowed the Aurora Boraelis to be visible across north Wales.,POSITIVE,0.9994034767150879,0.9994034767150879
10,NewsNews,https://www.bbc.com/news/wales,NEGATIVE,0.2519369277843209,43,4 hrs ago Wales Man denies murdering paedophile Lostprophets singer Ian Watkins in prison Samuel Dodsworth pleads not guilty to killing the paedophile singer at HMP Wakefield.,NEGATIVE,0.9453321695327759,-0.9453321695327759
10,NewsNews,https://www.bbc.com/news/wales,NEGATIVE,0.2519369277843209,43,4 hrs ago UK Families in Wales 'struggle' as cost pressures persist New report says parents of under 18s are among the groups most affected by cost of living pressures.,NEGATIVE,0.989307701587677,-0.989307701587677
10,NewsNews,https://www.bbc.com/news/wales,NEGATIVE,0.2519369277843209,43,"50 mins ago Wales 'My son, 4, has childhood dementia - I'm heartbroken' Tammy McDaid is raising funds to help her make memories with her son Tate.",POSITIVE,0.9635368585586548,0.9635368585586548
10,NewsNews,https://www.bbc.com/news/wales,NEGATIVE,0.2519369277843209,43,10 hrs ago Wales New weather warning issued with risk of flooding One warning is until 23:59 GMT on Wednesday and another from 06:00 on Friday to 06:00 on Saturday.,NEGATIVE,0.9672067165374756,-0.9672067165374756
10,NewsNews,https://www.bbc.com/news/wales,NEGATIVE,0.2519369277843209,43,5 hrs ago Wales Man denies murdering paedophile Lostprophets singer Ian Watkins in prison Samuel Dodsworth pleads not guilty to killing the paedophile singer at HMP Wakefield.,NEGATIVE,0.9482455849647522,-0.9482455849647522
10,NewsNews,https://www.bbc.com/news/wales,NEGATIVE,0.2519369277843209,43,Wales' papers: 'Nuclear power up' and woman's 'love for life' A review of the front page stories from the daily and weekly newspapers in Wales.,POSITIVE,0.9985918402671814,0.9985918402671814
10,NewsNews,https://www.bbc.com/news/wales,NEGATIVE,0.2519369277843209,43,"Woman died after becoming trapped under van Eleanor Thompson, 35, from Mold, was accidentally crushed in Australia in March, an inquest hears.",NEGATIVE,0.9575581550598145,-0.9575581550598145
10,NewsNews,https://www.bbc.com/news/wales,NEGATIVE,0.2519369277843209,43,"Farming inheritance tax causing uncertainty and confusion - MPs One accountant believes the plans will hit about 92% of farmers, not the predicted 7%.",NEGATIVE,0.9983705878257751,-0.9983705878257751
10,NewsNews,https://www.bbc.com/news/wales,NEGATIVE,0.2519369277843209,43,"Reform calls for review into BBC and Plaid relationship Reform highlighted the party's leader and head of political strategy, both who worked for the BBC.",POSITIVE,0.9929752349853516,0.9929752349853516
10,NewsNews,https://www.bbc.com/news/wales,NEGATIVE,0.2519369277843209,43,Features & analysis Charli XCX 'cried' during collaboration with music legend for Wuthering Heights soundtrack The singer was tearful over teaming up with the former Velvet Underground member.,NEGATIVE,0.7705100178718567,-0.7705100178718567
10,NewsNews,https://www.bbc.com/news/wales,NEGATIVE,0.2519369277843209,43,'I was spat at in the '70s because of my colour - those days are back' A man who was spat at because of his colour when he was young is worried about the political climate.,NEGATIVE,0.9940438866615295,-0.9940438866615295
10,NewsNews,https://www.bbc.com/news/wales,NEGATIVE,0.2519369277843209,43,How a wet Welsh summer helped create Winnie-the-Pooh The famous bear first featured among a collection of poems compiled in a potting shed in rainy Wales.,POSITIVE,0.9933931231498718,0.9933931231498718
10,NewsNews,https://www.bbc.com/news/wales,NEGATIVE,0.2519369277843209,43,"When my wife died, Elis James reached out - now we're close mates The comedian contacted Geraint John after his wife Deb died and has helped him while he grieves.",POSITIVE,0.9956594109535217,0.9956594109535217
10,NewsNews,https://www.bbc.com/news/wales,NEGATIVE,0.2519369277843209,43,"Botox was like going for coffee - but I had no idea if it was genuine Rules about administering drugs such as Botox and Mounjaro have not kept up, says Wales' regulator.",NEGATIVE,0.999083399772644,-0.999083399772644
10,NewsNews,https://www.bbc.com/news/wales,NEGATIVE,0.2519369277843209,43,"Watch/Listen Wales falls silent for Armistice Day Services were held across Wales, as people gathered to mark 107 years since the end of World War One.",NEGATIVE,0.8521950840950012,-0.8521950840950012
10,NewsNews,https://www.bbc.com/news/wales,NEGATIVE,0.2519369277843209,43,24 hrs ago Wales Reform UK says BBC 'infected with left-wing bias' Leader Nigel Farage cites Rhuanedd Richards' role as BBC director of nations as 'living proof' of bias.,NEGATIVE,0.9967942833900452,-0.9967942833900452
10,NewsNews,https://www.bbc.com/news/wales,NEGATIVE,0.2519369277843209,43,"1 day ago Wales CCTV shows sex attacker follow victim from nightclub Fawaz Alsamaou is warned he is ""highly likely"" to be deported after serving his sentence.",NEGATIVE,0.9941400289535522,-0.9941400289535522
