article_index,title,url,avg_label,avg_score,num_sentences,sentence,sent_label,sent_score,sent_value
8,NewsNews,https://www.bbc.com/news/scotland,NEGATIVE,0.18703593384651912,42,"News News Scotland Scotland Politics Scotland 'need next step' after New Zealand pain - Townsend Head coach Gregor Townsend hails an ""outstanding"" second-half display in the frustrating 25-17 loss to New Zealand, saying Scotland ""showed who we are"".",POSITIVE,0.9986429810523987,0.9986429810523987
8,NewsNews,https://www.bbc.com/news/scotland,NEGATIVE,0.18703593384651912,42,2 hrs ago Scottish Rugby Woman hit by harmful substance in housing estate Emergency services were called to the estate in East Kilbride on Friday morning.,NEGATIVE,0.9879025816917419,-0.9879025816917419
8,NewsNews,https://www.bbc.com/news/scotland,NEGATIVE,0.18703593384651912,42,10 hrs ago Glasgow & West Scotland Busy ferry route left with passenger-only service after car deck fault CalMac has suspended all weekend vehicle traffic to Stornoway following a problem with the car deck of MV Isle of Lewis 11 hrs ago Highlands & Islands Why are there never female headliners at TRNSMT festival?,NEGATIVE,0.9984779953956604,-0.9984779953956604
8,NewsNews,https://www.bbc.com/news/scotland,NEGATIVE,0.18703593384651912,42,The organisers of Scotland's biggest music festival have been criticised for failing to book any female headliners for its ninth year in a row.,NEGATIVE,0.9995642304420471,-0.9995642304420471
8,NewsNews,https://www.bbc.com/news/scotland,NEGATIVE,0.18703593384651912,42,14 hrs ago Glasgow & West Scotland Scottish Premiership: Reaction as Hibernian ease by St Mirren Listen to Sportsound and follow live text coverage of  St Mirren v Hibernian in the Scottish Premiership.,POSITIVE,0.9825066328048706,0.9825066328048706
8,NewsNews,https://www.bbc.com/news/scotland,NEGATIVE,0.18703593384651912,42,'Some children do not realise they are in a prison' A support service giving tailored support to families with a parent in prison launches in Dumfries.,NEGATIVE,0.9828452467918396,-0.9828452467918396
8,NewsNews,https://www.bbc.com/news/scotland,NEGATIVE,0.18703593384651912,42,"14 hrs ago South Scotland Elderly man dies in hospital after three-vehicle crash John McClumpha, 81, was taken to Forth Valley Hospital after the collision in Alloa on Thursday morning.",NEGATIVE,0.9935245513916016,-0.9935245513916016
8,NewsNews,https://www.bbc.com/news/scotland,NEGATIVE,0.18703593384651912,42,12 hrs ago Tayside & Central Scotland Celtic ban fans group after police and steward assault Police Scotland issue an appeal for witnesses to come forward after a steward and two officers were assaulted at Celtic Park.,NEGATIVE,0.9858330488204956,-0.9858330488204956
8,NewsNews,https://www.bbc.com/news/scotland,NEGATIVE,0.18703593384651912,42,"Alex Salmond died with debts of more than £340,000 Insolvency firm Begbies Traynor has named a trustee in sequestration to handle the former first minister's estate.",NEGATIVE,0.9114512205123901,-0.9114512205123901
8,NewsNews,https://www.bbc.com/news/scotland,NEGATIVE,0.18703593384651912,42,Your pictures of Scotland A selection of photographs submitted to BBC Scotland News from around the country this week.,POSITIVE,0.9970200657844543,0.9970200657844543
8,NewsNews,https://www.bbc.com/news/scotland,NEGATIVE,0.18703593384651912,42,What would the sale of ITV's television business to Sky mean for STV?,NEGATIVE,0.9992272853851318,-0.9992272853851318
8,NewsNews,https://www.bbc.com/news/scotland,NEGATIVE,0.18703593384651912,42,If ITV sells its broadcasting business to Sky it would have profound implications for British broadcasting.,NEGATIVE,0.9924718141555786,-0.9924718141555786
8,NewsNews,https://www.bbc.com/news/scotland,NEGATIVE,0.18703593384651912,42,"Lose weight or lose your jobs, offshore workers told Thousands of offshore workers are too heavy for the limitations of helicopter winch systems.",NEGATIVE,0.9996185302734375,-0.9996185302734375
8,NewsNews,https://www.bbc.com/news/scotland,NEGATIVE,0.18703593384651912,42,"Features and analysis A 20-minute date with a Tinder predator destroyed my life for years Nadia said the abuse started after she ended their date early because of ""red flags"".",NEGATIVE,0.9953228831291199,-0.9953228831291199
8,NewsNews,https://www.bbc.com/news/scotland,NEGATIVE,0.18703593384651912,42,How Scottish parties will try to maximise election votes in six months Opinion polls point to a fifth SNP victory - but a lot could change in six months with parties working flat out for votes.,NEGATIVE,0.9902778267860413,-0.9902778267860413
8,NewsNews,https://www.bbc.com/news/scotland,NEGATIVE,0.18703593384651912,42,Where is The Celebrity Traitors castle and can I ride the train?,NEGATIVE,0.9912928938865662,-0.9912928938865662
8,NewsNews,https://www.bbc.com/news/scotland,NEGATIVE,0.18703593384651912,42,Ardross Castle in the Highlands has links to a controversial duke and Worcestershire sauce.,POSITIVE,0.9869790077209473,0.9869790077209473
8,NewsNews,https://www.bbc.com/news/scotland,NEGATIVE,0.18703593384651912,42,How Scotland shaped Frankenstein on page and screen The latest film of the classic tale uses Scottish locations which inspired director Guillermo Del Toro.,POSITIVE,0.9992985725402832,0.9992985725402832
8,NewsNews,https://www.bbc.com/news/scotland,NEGATIVE,0.18703593384651912,42,"'Scotland's oldest bakery' up for sale after 200 years Barry and Claire Taylor are the sixth generation to run Scotland's oldest bakery in Strathaven, South Lanarkshire.",POSITIVE,0.9991859793663025,0.9991859793663025
8,NewsNews,https://www.bbc.com/news/scotland,NEGATIVE,0.18703593384651912,42,"News from around Scotland Man, 66, injured after being hit by tram in Edinburgh Emergency services closed off Constitution Street in Leith after the incident on Friday afternoon.",NEGATIVE,0.9846712946891785,-0.9846712946891785
8,NewsNews,https://www.bbc.com/news/scotland,NEGATIVE,0.18703593384651912,42,"Busy ferry route left with passenger-only service after car deck fault CalMac has suspended all weekend vehicle traffic to Stornoway following a problem with the car deck of MV Isle of Lewis Lose weight or lose your jobs, offshore workers told Thousands of offshore workers are too heavy for the limitations of helicopter winch systems.",NEGATIVE,0.9989407658576965,-0.9989407658576965
8,NewsNews,https://www.bbc.com/news/scotland,NEGATIVE,0.18703593384651912,42,'Some children do not realise they are in a prison' A support service giving tailored support to families with a parent in prison launches in Dumfries.,NEGATIVE,0.9828452467918396,-0.9828452467918396
8,NewsNews,https://www.bbc.com/news/scotland,NEGATIVE,0.18703593384651912,42,"Elderly man dies in hospital after three-vehicle crash John McClumpha, 81, was taken to Forth Valley Hospital after the collision in Alloa on Thursday morning.",NEGATIVE,0.9974259734153748,-0.9974259734153748
8,NewsNews,https://www.bbc.com/news/scotland,NEGATIVE,0.18703593384651912,42,"Sport 'Scotland looked immortality in the eye and said not today' Tom English reflects on Scotland's ""exhilarating and infuriating"" display in the 25-17 defeat by New Zealand at Murrayfield.",POSITIVE,0.9590155482292175,0.9590155482292175
8,NewsNews,https://www.bbc.com/news/scotland,NEGATIVE,0.18703593384651912,42,"Scotland 'need next step' after New Zealand pain - Townsend Head coach Gregor Townsend hails an ""outstanding"" second-half display in the frustrating 25-17 loss to New Zealand, saying Scotland ""showed who we are"".",POSITIVE,0.9987605810165405,0.9987605810165405
8,NewsNews,https://www.bbc.com/news/scotland,NEGATIVE,0.18703593384651912,42,Hibs go third with win over frustrated St Mirren St Mirren have two goals ruled out by VAR as Hibernian return to third in the Scottish Premiership.,POSITIVE,0.8739727139472961,0.8739727139472961
8,NewsNews,https://www.bbc.com/news/scotland,NEGATIVE,0.18703593384651912,42,All Blacks shatter Scotland's hopes of historic win New Zealand survive three yellow cards and a second-half onslaught to maintain their unbeaten record against Scotland by edging a game for the ages 17-25.,POSITIVE,0.9966098666191101,0.9966098666191101
8,NewsNews,https://www.bbc.com/news/scotland,NEGATIVE,0.18703593384651912,42,Livingston snatch dramatic late point at Falkirk Danny Wilson rescues a point for Livingston late on at Falkirk in the Scottish Premiership.,POSITIVE,0.9905707836151123,0.9905707836151123
8,NewsNews,https://www.bbc.com/news/scotland,NEGATIVE,0.18703593384651912,42,More news on iPlayer and Sounds Reporting Scotland Big stories from across the country Scotcast The BBC's Scottish news podcast.,NEGATIVE,0.9620128870010376,-0.9620128870010376
8,NewsNews,https://www.bbc.com/news/scotland,NEGATIVE,0.18703593384651912,42,Reporting Scotland: News at Seven More from the day’s top stories and communities across Scotland.,POSITIVE,0.9981580376625061,0.9981580376625061
8,NewsNews,https://www.bbc.com/news/scotland,NEGATIVE,0.18703593384651912,42,Good Morning Scotland The nation's morning news programme.,POSITIVE,0.9996204376220703,0.9996204376220703
8,NewsNews,https://www.bbc.com/news/scotland,NEGATIVE,0.18703593384651912,42,Latest updates 13 hrs ago Scotland's papers: Raising income tax 'would hit workers' and maternity plea A review of the front page stories from the daily newspapers in Scotland.,POSITIVE,0.5616357922554016,0.5616357922554016
8,NewsNews,https://www.bbc.com/news/scotland,NEGATIVE,0.18703593384651912,42,"13 hrs ago 1 day ago Lose weight or lose your jobs, offshore workers told Thousands of offshore workers are too heavy for the limitations of helicopter winch systems.",NEGATIVE,0.9992315769195557,-0.9992315769195557
8,NewsNews,https://www.bbc.com/news/scotland,NEGATIVE,0.18703593384651912,42,"1 day ago 1 day ago 'Substantial' risk to life from fire in school, report finds The BBC has seen the report which points out issues with fire doors, fire exits and the storage of combustibles at Lenzie Academy.",NEGATIVE,0.6007758975028992,-0.6007758975028992
8,NewsNews,https://www.bbc.com/news/scotland,NEGATIVE,0.18703593384651912,42,1 day ago 1 day ago Your pictures of Scotland: 31 October to 7 November A selection of photographs submitted to BBC Scotland News from around the country this week.,POSITIVE,0.9765589237213135,0.9765589237213135
8,NewsNews,https://www.bbc.com/news/scotland,NEGATIVE,0.18703593384651912,42,1 day ago 2 days ago Scotland's papers: Pupil terror watchlist and fireworks fears A review of the front page stories from the daily newspapers in Scotland.,NEGATIVE,0.9647892117500305,-0.9647892117500305
8,NewsNews,https://www.bbc.com/news/scotland,NEGATIVE,0.18703593384651912,42,"2 days ago 2 days ago Cash prize to boost new art talent in Jack Vettriano's memory An award of £7,500 will boost the career of a new talent following in his footsteps.",POSITIVE,0.999671459197998,0.999671459197998
8,NewsNews,https://www.bbc.com/news/scotland,NEGATIVE,0.18703593384651912,42,"The £7,500 prize will be given to an artist without any formal training through the Royal Scottish Academy 2 days ago 2 days ago 'Notable reduction' in Bonfire Night disruption Police say between Halloween and Bonfire Night, 833 calls needed a local or specialist response, almost 500 fewer than last year.",NEGATIVE,0.9951565265655518,-0.9951565265655518
8,NewsNews,https://www.bbc.com/news/scotland,NEGATIVE,0.18703593384651912,42,2 days ago 2 days ago Meet the All Black named after William Wallace New Zealand back row Wallace Sititi needs little education on Scotland.,NEGATIVE,0.9822375178337097,-0.9822375178337097
8,NewsNews,https://www.bbc.com/news/scotland,NEGATIVE,0.18703593384651912,42,"After all, he is named after one of the country's great historical figures, William Wallace.",POSITIVE,0.9981050491333008,0.9981050491333008
8,NewsNews,https://www.bbc.com/news/scotland,NEGATIVE,0.18703593384651912,42,"2 days ago 2 days ago Record number of referrals made to anti-terrorism scheme Some 162 reports were made to Prevent, and extreme right-wing concerns made up the largest proportion.",NEGATIVE,0.9717385768890381,-0.9717385768890381
8,NewsNews,https://www.bbc.com/news/scotland,NEGATIVE,0.18703593384651912,42,2 days ago 1 2 3 4 5 ... 12,NEGATIVE,0.9041860699653625,-0.9041860699653625
9,NewsNews,https://www.bbc.com/news/scotland/scotland_politics,NEGATIVE,0.8294257998466492,20,"News News Scotland Scotland Politics Alex Salmond died with debts of more than £340,000 Insolvency firm Begbies Traynor has named a trustee in sequestration to handle the former first minister's estate.",NEGATIVE,0.9088748693466187,-0.9088748693466187
9,NewsNews,https://www.bbc.com/news/scotland/scotland_politics,NEGATIVE,0.8294257998466492,20,1 day ago Scotland Politics How Scottish parties will try to maximise election votes in six months Opinion polls point to a fifth SNP victory - but a lot could change in six months with parties working flat out for votes.,NEGATIVE,0.987793505191803,-0.987793505191803
9,NewsNews,https://www.bbc.com/news/scotland/scotland_politics,NEGATIVE,0.8294257998466492,20,2 days ago Scotland Politics Ministers to order investigation into maternity services The decision follows a BBC Disclosure documentary which heard calls for urgent action to improve safety.,NEGATIVE,0.9841601252555847,-0.9841601252555847
9,NewsNews,https://www.bbc.com/news/scotland/scotland_politics,NEGATIVE,0.8294257998466492,20,"2 days ago Scotland Politics Record number of referrals made to anti-terrorism scheme Some 162 reports were made to Prevent, and extreme right-wing concerns made up the largest proportion.",NEGATIVE,0.9282808899879456,-0.9282808899879456
9,NewsNews,https://www.bbc.com/news/scotland/scotland_politics,NEGATIVE,0.8294257998466492,20,2 days ago Scotland Whip restored to suspended Labour MP Leishman Alloa and Grangemouth MP Brian Leishman is returning to the Labour benches after a four-month suspension.,NEGATIVE,0.7602742910385132,-0.7602742910385132
9,NewsNews,https://www.bbc.com/news/scotland/scotland_politics,NEGATIVE,0.8294257998466492,20,24 hrs ago Tayside & Central Scotland Scottish government reveals plan to reach net zero targets by 2045 The route map includes targets to decarbonise building heat systems and phase out new petrol and diesel cars.,NEGATIVE,0.9949617385864258,-0.9949617385864258
9,NewsNews,https://www.bbc.com/news/scotland/scotland_politics,NEGATIVE,0.8294257998466492,20,"2 days ago Scotland Politics Swinney does not rule out tax hikes in Scotland The first minister was urged to give a ""cast-iron"" guarantee that he would not increase rates in the Budget.",NEGATIVE,0.9879200458526611,-0.9879200458526611
9,NewsNews,https://www.bbc.com/news/scotland/scotland_politics,NEGATIVE,0.8294257998466492,20,2 days ago Scotland Politics MSPs pass land reform which could force break up of huge estates The legislation is designed to help reduce the concentration of rural land ownership among a small number of people.,NEGATIVE,0.6208032965660095,-0.6208032965660095
9,NewsNews,https://www.bbc.com/news/scotland/scotland_politics,NEGATIVE,0.8294257998466492,20,Why the battle still rages over land ownership in Scotland The reaction to the Scottish government's wide-ranging new laws show the divided opinions on the issue.,NEGATIVE,0.8714632987976074,-0.8714632987976074
9,NewsNews,https://www.bbc.com/news/scotland/scotland_politics,NEGATIVE,0.8294257998466492,20,"Mental health, buses and school meals - issues that matter to first-time voters Teenagers who could vote for the first time next year put politicians through their paces at an event in Dumfries.",NEGATIVE,0.9702868461608887,-0.9702868461608887
9,NewsNews,https://www.bbc.com/news/scotland/scotland_politics,NEGATIVE,0.8294257998466492,20,Fire safety law named in memory of Cameron House victims The Cameron House fire at Loch Lomond claimed the lives of London couple Simon Midgley and Richard Dyson in December 2017.,NEGATIVE,0.8101789355278015,-0.8101789355278015
9,NewsNews,https://www.bbc.com/news/scotland/scotland_politics,NEGATIVE,0.8294257998466492,20,"Police funding warning as reports of online child abuse doubles Police Scotland Chief Constable Jo Farrell said the national force received 1,500 reports in 2024-25 compared to 700 in the previous 12 months.",NEGATIVE,0.9928200840950012,-0.9928200840950012
9,NewsNews,https://www.bbc.com/news/scotland/scotland_politics,NEGATIVE,0.8294257998466492,20,Features and analysis Why is land reform on the agenda in Scotland?,NEGATIVE,0.9663165211677551,-0.9663165211677551
9,NewsNews,https://www.bbc.com/news/scotland/scotland_politics,NEGATIVE,0.8294257998466492,20,MSPs are set to vote on legislation which could allow the government to intervene in private land sales.,POSITIVE,0.9482805132865906,0.9482805132865906
9,NewsNews,https://www.bbc.com/news/scotland/scotland_politics,NEGATIVE,0.8294257998466492,20,"Sabotage, betrayal, secrecy... and recycling How a £50m court case over Scotland's deposit return scheme turned into a political blockbuster.",NEGATIVE,0.9919211864471436,-0.9919211864471436
9,NewsNews,https://www.bbc.com/news/scotland/scotland_politics,NEGATIVE,0.8294257998466492,20,"A bridge, 130 convictions and a 30-year fight: The tolls that made criminals of islanders More than 100 people received criminal convictions after refusing to pay tolls on the Skye Bridge.",NEGATIVE,0.9545219540596008,-0.9545219540596008
9,NewsNews,https://www.bbc.com/news/scotland/scotland_politics,NEGATIVE,0.8294257998466492,20,Why is the government being sued for £170m over a recycling scheme?,NEGATIVE,0.9983195662498474,-0.9983195662498474
9,NewsNews,https://www.bbc.com/news/scotland/scotland_politics,NEGATIVE,0.8294257998466492,20,A waste management firm has launched legal action over a beleaguered bottle return plan.,NEGATIVE,0.9971309900283813,-0.9971309900283813
9,NewsNews,https://www.bbc.com/news/scotland/scotland_politics,NEGATIVE,0.8294257998466492,20,Is the Scottish government softening on oil and gas?,NEGATIVE,0.9976902008056641,-0.9976902008056641
9,NewsNews,https://www.bbc.com/news/scotland/scotland_politics,NEGATIVE,0.8294257998466492,20,"Has John Swinney shifted the Scottish government away from a ""presumption against"" new oil and gas?",NEGATIVE,0.8130781650543213,-0.8130781650543213
10,NewsNews,https://www.bbc.com/news/wales,NEGATIVE,0.2499624678963109,38,"News News Wales Wales Politics Neurodivergent children left to 'fall through the cracks' Parents of ""the gap children"" with additional needs say suitable education provision is crucial.",NEGATIVE,0.9879724383354187,-0.9879724383354187
10,NewsNews,https://www.bbc.com/news/wales,NEGATIVE,0.2499624678963109,38,24 mins ago Wales Seal swims 14 miles up river and surprises anglers Grey juvenile seal surprises anglers and walkers after being seen far from the Welsh coast.,POSITIVE,0.9976999163627625,0.9976999163627625
10,NewsNews,https://www.bbc.com/news/wales,NEGATIVE,0.2499624678963109,38,20 mins ago Wales Matthew Rhys says playing Richard Burton 'terrifying' Matthew Rhys will play Richard Burton in a one-man show with the Welsh National Theatre this month.,POSITIVE,0.9907031059265137,0.9907031059265137
10,NewsNews,https://www.bbc.com/news/wales,NEGATIVE,0.2499624678963109,38,"7 hrs ago Wales Two former Labour council leaders join Greens Robert James and Sean Morgan have both defected, according to the Green Party.",NEGATIVE,0.9262242317199707,-0.9262242317199707
10,NewsNews,https://www.bbc.com/news/wales,NEGATIVE,0.2499624678963109,38,5 hrs ago Wales Rugby hooker called prostitute in Virgin Media Welsh translation gaffe Virgin Media apologises after using Welsh word for prostitute to describe Wales hooker Ryan Elias.,NEGATIVE,0.9980608820915222,-0.9980608820915222
10,NewsNews,https://www.bbc.com/news/wales,NEGATIVE,0.2499624678963109,38,"13 hrs ago Wales Senedd election to scrap overnight vote count The election is scheduled for 7 May 2026, with counting to begin the following day.",NEGATIVE,0.8595492243766785,-0.8595492243766785
10,NewsNews,https://www.bbc.com/news/wales,NEGATIVE,0.2499624678963109,38,"3 hrs ago Wales Concerns raised decade before paedophile head teacher jailed - parent Parents, pupils, and staff have said the paedophile head teacher created a culture of fear at his school.",NEGATIVE,0.9797137379646301,-0.9797137379646301
10,NewsNews,https://www.bbc.com/news/wales,NEGATIVE,0.2499624678963109,38,"15 hrs ago Wales When my wife died, Elis James reached out - now we're close mates The comedian contacted Geraint John after his wife Deb died and has helped him while he grieves.",POSITIVE,0.9948496222496033,0.9948496222496033
10,NewsNews,https://www.bbc.com/news/wales,NEGATIVE,0.2499624678963109,38,Six officers face misconduct hearing over triple death crash A group of five people were reported missing before being found in a crashed car two days later.,NEGATIVE,0.9965633749961853,-0.9965633749961853
10,NewsNews,https://www.bbc.com/news/wales,NEGATIVE,0.2499624678963109,38,Family ordered to take down 2m garden fence It was put up without permission at their home between February and April.,NEGATIVE,0.9972860813140869,-0.9972860813140869
10,NewsNews,https://www.bbc.com/news/wales,NEGATIVE,0.2499624678963109,38,Two arrests after baby killed in XL bully dog attack The nine-month-old baby boy died at the scene in south-east Wales on Sunday evening.,NEGATIVE,0.9660122394561768,-0.9660122394561768
10,NewsNews,https://www.bbc.com/news/wales,NEGATIVE,0.2499624678963109,38,"Luke Evans leads 'gripping' new drama filmed in Wales Filming for The Party, which is based on the 2017 book by Elizabeth Day, has started.",POSITIVE,0.999064028263092,0.999064028263092
10,NewsNews,https://www.bbc.com/news/wales,NEGATIVE,0.2499624678963109,38,"Features & analysis Botox was like going for coffee - but I had no idea if it was genuine Rules about administering drugs such as Botox and Mounjaro have not kept up, says Wales' regulator.",NEGATIVE,0.9991185069084167,-0.9991185069084167
10,NewsNews,https://www.bbc.com/news/wales,NEGATIVE,0.2499624678963109,38,Actor Paul Whitehouse's 'pride' in Welsh roots The comedian visited Wales with fellow comedian Bob Mortimer in their TV show Gone Fishing.,POSITIVE,0.9985287189483643,0.9985287189483643
10,NewsNews,https://www.bbc.com/news/wales,NEGATIVE,0.2499624678963109,38,"My one-year-old eats books, toys, tables and even his cot Junior has a condition called pica that makes him crave and eat inedible objects.",NEGATIVE,0.9080767035484314,-0.9080767035484314
10,NewsNews,https://www.bbc.com/news/wales,NEGATIVE,0.2499624678963109,38,Traitors star is 'grateful for abnormal anatomy' A very rare condition led to an important diagnosis after years of pain for The Traitors star.,POSITIVE,0.9233381152153015,0.9233381152153015
10,NewsNews,https://www.bbc.com/news/wales,NEGATIVE,0.2499624678963109,38,Meet the 'silver influencers' taking TikTok and Instagram by storm Older women are carving out a niche online for people who want authentic content.,NEGATIVE,0.8705869317054749,-0.8705869317054749
10,NewsNews,https://www.bbc.com/news/wales,NEGATIVE,0.2499624678963109,38,Watch/Listen Having 'Botox like going to get a morning coffee' Lizzie Day says having Botox was as much a part of her routine as getting her morning coffee.,NEGATIVE,0.9959638118743896,-0.9959638118743896
10,NewsNews,https://www.bbc.com/news/wales,NEGATIVE,0.2499624678963109,38,"2 days ago Wales CCTV shows sex attacker follow victim from nightclub Fawaz Alsamaou is warned he is ""highly likely"" to be deported after serving his sentence.",NEGATIVE,0.9948699474334717,-0.9948699474334717
10,NewsNews,https://www.bbc.com/news/wales,NEGATIVE,0.2499624678963109,38,"3 days ago Sir Anthony Hopkins on playing the infamous Hannibal Lecter The Oscar-winning actor sat down with the BBC's Katie Razzall ahead of the release of his auto-biography We did OK, Kid.",NEGATIVE,0.9930168390274048,-0.9930168390274048
10,NewsNews,https://www.bbc.com/news/wales,NEGATIVE,0.2499624678963109,38,5 days ago Lorry driver who blamed fatal crash on cough exposed by dashcam Mariusz Korkosz was driving incorrectly for almost 20 seconds before colliding head-on with a truck.,NEGATIVE,0.9977889060974121,-0.9977889060974121
10,NewsNews,https://www.bbc.com/news/wales,NEGATIVE,0.2499624678963109,38,"3 days ago Wales Widespread disruption as Wales hit by flooding Flood warnings are in places across Carmarthenshire, Pembrokeshire and Swansea.",NEGATIVE,0.8535415530204773,-0.8535415530204773
10,NewsNews,https://www.bbc.com/news/wales,NEGATIVE,0.2499624678963109,38,3 days ago Sport Sheehan insists he is the right man to lead Swans Alan Sheehan insists he is the right man to lead Swansea City despite seeing his side's difficult run continue as they are thumped 4-1 at home  by Ipswich Town.,POSITIVE,0.9654181599617004,0.9654181599617004
10,NewsNews,https://www.bbc.com/news/wales,NEGATIVE,0.2499624678963109,38,Tonmawr's Tandy prepares for Wales coaching debut BBC Sport Wales talks to people who have been part of Steve Tandy's journey from Tonmawr junior to Wales head coach.,POSITIVE,0.9970600008964539,0.9970600008964539
10,NewsNews,https://www.bbc.com/news/wales,NEGATIVE,0.2499624678963109,38,Stories from Cymru Fyw Pryder am 'amddifadu' plant o ieithoedd modern wrth i niferoedd ostwng Mae'r ffigyrau diweddara yn dangos gostyngiad pellach yn y nifer sy'n astudio ieithoedd tramor yng Nghymru ar ôl cwblhau TGAU.,NEGATIVE,0.9395338296890259,-0.9395338296890259
10,NewsNews,https://www.bbc.com/news/wales,NEGATIVE,0.2499624678963109,38,'Mae'n bwysig cael laff gyda fy ffrind wrth alaru' Mae'r digrifwr Elis James a'i ffrind Geraint John  yn bwriadu codi arian i'r hosbis wnaeth gefnogi gwraig Geraint yn ei misoedd olaf.,NEGATIVE,0.9548287391662598,-0.9548287391662598
