article_index,title,url,avg_label,avg_score,num_sentences,sentence,sent_label,sent_score,sent_value
10,NewsNews,https://www.bbc.com/news/wales,NEGATIVE,0.2519369277843209,43,"7 days ago Archive: Richard Burton speaks of his home village Burton, who would have turned 100 this year, starred in Cleopatra and Shakespearean stage roles.",POSITIVE,0.9945916533470154,0.9945916533470154
10,NewsNews,https://www.bbc.com/news/wales,NEGATIVE,0.2519369277843209,43,2 days ago Wales Lorry driver who blamed fatal crash on cough exposed by dashcam Mariusz Korkosz was driving incorrectly for almost 20 seconds before colliding head-on with a truck.,NEGATIVE,0.9975467324256897,-0.9975467324256897
10,NewsNews,https://www.bbc.com/news/wales,NEGATIVE,0.2519369277843209,43,"7 days ago Wales Sport 'Faster, stronger' Rees-Zammit wants Wales start Wales wing Louis Rees-Zammit says he back from American football with more pace, power and strength.",POSITIVE,0.9979732632637024,0.9979732632637024
10,NewsNews,https://www.bbc.com/news/wales,NEGATIVE,0.2519369277843209,43,"Euro 2028 bid a 'massive' motivation for Bellamy Craig Bellamy says the prospect of managing Wales at a major tournament on home soil is a ""massive"" motivation as he looks ahead to Euro 2028.",POSITIVE,0.9971016049385071,0.9971016049385071
10,NewsNews,https://www.bbc.com/news/wales,NEGATIVE,0.2519369277843209,43,Cracknell fulfils Wales dream after tough times Olly Cracknell credits his family resilience for helping him achieve his international dream with Wales in the autumn series.,POSITIVE,0.9996391534805298,0.9996391534805298
10,NewsNews,https://www.bbc.com/news/wales,NEGATIVE,0.2519369277843209,43,Who next for Swansea amid Hellberg links?,NEGATIVE,0.9936151504516602,-0.9936151504516602
10,NewsNews,https://www.bbc.com/news/wales,NEGATIVE,0.2519369277843209,43,"BBC Sport Wales takes a look at who could be in the frame to become the new Swansea City boss, with Kim Hellberg emerging as the favourite.",POSITIVE,0.9987233281135559,0.9987233281135559
10,NewsNews,https://www.bbc.com/news/wales,NEGATIVE,0.2519369277843209,43,Wolves appoint ex-defender Edwards as manager Wolves finally have their man.,POSITIVE,0.9983761310577393,0.9983761310577393
10,NewsNews,https://www.bbc.com/news/wales,NEGATIVE,0.2519369277843209,43,But how big a gamble have the Premier League side made in appointing Rob Edwards?,NEGATIVE,0.9938368201255798,-0.9938368201255798
10,NewsNews,https://www.bbc.com/news/wales,NEGATIVE,0.2519369277843209,43,"Stories from Cymru Fyw AS Reform Laura Anne Jones yn wynebu gwaharddiad am bythefnos Dywedodd y pwyllgor safonau ""nad oes lle i sylwadau amhriodol a sarhaus yn ein Senedd nac yn ein cymdeithas yn ehangach"".",NEGATIVE,0.925442636013031,-0.925442636013031
10,NewsNews,https://www.bbc.com/news/wales,NEGATIVE,0.2519369277843209,43,"Comisiynydd y Gymraeg 'wedi colli'i ffordd' - Cymdeithas yr Iaith Cymdeithas yr Iaith yn cyhuddo Comisiynydd y Gymraeg o ""golli'i ffordd"" am fod canran a nifer yr ymchwiliadau sy'n cael eu cynnal wedi gostwng yn sylweddol.",NEGATIVE,0.9775795340538025,-0.9775795340538025
10,NewsNews,https://www.bbc.com/news/wales,NEGATIVE,0.2519369277843209,43,"'Dwi eisiau helpu plant eraill sy'n wynebu canser fel nes i' Yn wyth oed cafodd Kathryn ddiagnosis o fath prin o ganser y gwaed, ac ar ôl gwella ei nod erbyn hyn yw helpu eraill sy'n derbyn diagnosis tebyg.",NEGATIVE,0.9799504280090332,-0.9799504280090332
10,NewsNews,https://www.bbc.com/news/wales,NEGATIVE,0.2519369277843209,43,Y ddwy ffrind o Ddyffryn Peris sy'n annog pobl ifanc i  ddawnsio Mae Chloe Roberts o Lanrug a Iola Bryn Jones o Ddeiniolen yn credu y gall dawnsio drawsnewid bywyd plant a phobl ifanc.,NEGATIVE,0.9548466801643372,-0.9548466801643372
10,NewsNews,https://www.bbc.com/news/wales,NEGATIVE,0.2519369277843209,43,"Latest updates Just now Badger rescued after falling down manhole The ""inquisitive"" creature fell 4ft (1.2m) down a shaft while foraging for food before the winter.",NEGATIVE,0.9979113936424255,-0.9979113936424255
10,NewsNews,https://www.bbc.com/news/wales,NEGATIVE,0.2519369277843209,43,Just now 50 mins ago Families in Wales 'struggle' as cost pressures persist New report says parents of under 18s are among the groups most affected by cost of living pressures.,NEGATIVE,0.990139365196228,-0.990139365196228
10,NewsNews,https://www.bbc.com/news/wales,NEGATIVE,0.2519369277843209,43,"50 mins ago 2 hrs ago Reform politician faces suspension over WhatsApp racial slur Laura Anne Jones used a racial slur to describe Chinese people, in August 2023, in a WhatsApp chat.",NEGATIVE,0.997378945350647,-0.997378945350647
10,NewsNews,https://www.bbc.com/news/wales,NEGATIVE,0.2519369277843209,43,"2 hrs ago 3 hrs ago 'No warning signs' on beach where dad and son drowned The dad and son, from Blackwood in Caerphilly county, were swept out to sea while on holiday, an inquest hears.",NEGATIVE,0.972772479057312,-0.972772479057312
10,NewsNews,https://www.bbc.com/news/wales,NEGATIVE,0.2519369277843209,43,3 hrs ago 4 hrs ago Northern Lights leave sky-gazers in awe A powerful solar storm allowed the Aurora Boraelis to be visible across north Wales.,POSITIVE,0.999267041683197,0.999267041683197
10,NewsNews,https://www.bbc.com/news/wales,NEGATIVE,0.2519369277843209,43,4 hrs ago 5 hrs ago New weather warning issued with risk of flooding One warning is until 23:59 GMT on Wednesday and another from 06:00 on Friday to 06:00 on Saturday.,NEGATIVE,0.9754787683486938,-0.9754787683486938
10,NewsNews,https://www.bbc.com/news/wales,NEGATIVE,0.2519369277843209,43,"5 hrs ago 10 hrs ago Farming inheritance tax causing uncertainty and confusion - MPs One accountant believes the plans will hit about 92% of farmers, not the predicted 7%.",NEGATIVE,0.9970947504043579,-0.9970947504043579
10,NewsNews,https://www.bbc.com/news/wales,NEGATIVE,0.2519369277843209,43,10 hrs ago 10 hrs ago Wales' papers: 'Nuclear power up' and woman's 'love for life' A review of the front page stories from the daily and weekly newspapers in Wales.,POSITIVE,0.9930073022842407,0.9930073022842407
10,NewsNews,https://www.bbc.com/news/wales,NEGATIVE,0.2519369277843209,43,"10 hrs ago 10 hrs ago 'My son, 4, has childhood dementia - I'm heartbroken' Tammy McDaid is raising funds to help her make memories with her son Tate.",POSITIVE,0.7918742895126343,0.7918742895126343
10,NewsNews,https://www.bbc.com/news/wales,NEGATIVE,0.2519369277843209,43,10 hrs ago 1 2 3 4 5 ... 11,POSITIVE,0.561060905456543,0.561060905456543
11,NewsNews,https://www.bbc.com/news/wales/wales_politics,NEGATIVE,0.6647778898477554,12,"News News Wales Wales Politics Reform politician faces suspension over WhatsApp racial slur Laura Anne Jones used a racial slur to describe Chinese people, in August 2023, in a WhatsApp chat.",NEGATIVE,0.9968795776367188,-0.9968795776367188
11,NewsNews,https://www.bbc.com/news/wales/wales_politics,NEGATIVE,0.6647778898477554,12,2 hrs ago Wales Families in Wales 'struggle' as cost pressures persist New report says parents of under 18s are among the groups most affected by cost of living pressures.,NEGATIVE,0.9848716855049133,-0.9848716855049133
11,NewsNews,https://www.bbc.com/news/wales/wales_politics,NEGATIVE,0.6647778898477554,12,50 mins ago Wales New NHS boss 'concerned' about health board targets Jacqueline Totterdell says the Betsi Cadwaladr health board may fall short of its waiting time targets.,NEGATIVE,0.9978668093681335,-0.9978668093681335
11,NewsNews,https://www.bbc.com/news/wales/wales_politics,NEGATIVE,0.6647778898477554,12,"1 day ago Wales Reform calls for review into BBC and Plaid relationship Reform highlighted the party's leader and head of political strategy, both who worked for the BBC.",POSITIVE,0.9764689207077026,0.9764689207077026
11,NewsNews,https://www.bbc.com/news/wales/wales_politics,NEGATIVE,0.6647778898477554,12,"20 hrs ago Wales Farming inheritance tax causing uncertainty and confusion - MPs One accountant believes the plans will hit about 92% of farmers, not the predicted 7%.",NEGATIVE,0.9965656399726868,-0.9965656399726868
11,NewsNews,https://www.bbc.com/news/wales/wales_politics,NEGATIVE,0.6647778898477554,12,10 hrs ago Wales Wylfa nuclear plans expected to get go-ahead in days Anglesey is understood to have been chosen after UK ministers reached a decision on the site.,NEGATIVE,0.9911848902702332,-0.9911848902702332
11,NewsNews,https://www.bbc.com/news/wales/wales_politics,NEGATIVE,0.6647778898477554,12,"1 day ago Wales Jobless rise shows Labour plan failing, say Tories Tory Senedd leader says the first minister will not accept responsibility for Wales' economic woes.",NEGATIVE,0.9997879862785339,-0.9997879862785339
11,NewsNews,https://www.bbc.com/news/wales/wales_politics,NEGATIVE,0.6647778898477554,12,1 day ago Wales First Minister's Questions from the Senedd: 11 November 2025 Eluned Morgan is quizzed by opposition party leaders and other MSs during First Minister's Questions.,POSITIVE,0.940351128578186,0.940351128578186
11,NewsNews,https://www.bbc.com/news/wales/wales_politics,NEGATIVE,0.6647778898477554,12,"FAW silent over replacing late Queen as patron A petition in 2023 demanded ""no more Royal patronage"" and attracted 1,883 signatures.",NEGATIVE,0.9931225180625916,-0.9931225180625916
11,NewsNews,https://www.bbc.com/news/wales/wales_politics,NEGATIVE,0.6647778898477554,12,"Senedd election 'tipping point' for Starmer as PM One source calls the prime minister ""absolutely delusional"" about the likely result next May.",NEGATIVE,0.9904766082763672,-0.9904766082763672
11,NewsNews,https://www.bbc.com/news/wales/wales_politics,NEGATIVE,0.6647778898477554,12,"Two former Labour council leaders join Greens Robert James and Sean Morgan have both defected, according to the Green Party.",NEGATIVE,0.9737919569015503,-0.9737919569015503
11,NewsNews,https://www.bbc.com/news/wales/wales_politics,NEGATIVE,0.6647778898477554,12,"Senedd election to scrap overnight vote count The election is scheduled for 7 May 2026, with counting to begin the following day.",NEGATIVE,0.9696070551872253,-0.9696070551872253
12,NewsNews,https://www.bbc.com/news/world/africa,NEGATIVE,0.21918333942691484,48,"News News Africa At least six die in crush at Ghana military recruitment event Thousands had turned up to El-Wak stadium, in the capital Accra, with hopes of being enlisted.",NEGATIVE,0.9795929193496704,-0.9795929193496704
12,NewsNews,https://www.bbc.com/news/world/africa,NEGATIVE,0.21918333942691484,48,1 hr ago Africa Wife and son of Gabon's ousted leader given 20-year jail terms in two-day corruption trial They were not in court and have described the charges against them as “a legal farce”.,NEGATIVE,0.9863102436065674,-0.9863102436065674
12,NewsNews,https://www.bbc.com/news/world/africa,NEGATIVE,0.21918333942691484,48,"47 mins ago Africa 'There was a state of terror': Sudan hospital worker describes fleeing before alleged massacre ""I have lost the people whose faces I used to see smiling,"" says Abdu-Rabbu Ahmed after escaping el-Fasher.",NEGATIVE,0.9984440207481384,-0.9984440207481384
12,NewsNews,https://www.bbc.com/news/world/africa,NEGATIVE,0.21918333942691484,48,"23 hrs ago Africa Investigators blame bad weather for helicopter crash that killed two ministers in Ghana Two months ago, a military helicopter plummeted in a dense forest, killing eight people.",NEGATIVE,0.9955316781997681,-0.9955316781997681
12,NewsNews,https://www.bbc.com/news/world/africa,NEGATIVE,0.21918333942691484,48,"22 hrs ago Africa How jihadists have brought a nation to a standstill with their fuel blockade Mali has been paralysed by a fuel blockade, which has disrupted transport, schools, hospitals and more.",NEGATIVE,0.9991005659103394,-0.9991005659103394
12,NewsNews,https://www.bbc.com/news/world/africa,NEGATIVE,0.21918333942691484,48,15 hrs ago Africa Nigerians praise young soldier for standing up to powerful minister The confrontation struck a chord with many Nigerians because of Nyesom Wike's political stature.,POSITIVE,0.9993634819984436,0.9993634819984436
12,NewsNews,https://www.bbc.com/news/world/africa,NEGATIVE,0.21918333942691484,48,1 hr ago Africa Brothers charged with South African rapper's murder after extradition The Ndimande brothers returned after a lengthy battle to block their extradition from Eswatini.,NEGATIVE,0.9944610595703125,-0.9944610595703125
12,NewsNews,https://www.bbc.com/news/world/africa,NEGATIVE,0.21918333942691484,48,4 hrs ago Africa Nigeria boycott training before World Cup play-off Nigeria players refused to train ahead of their crucial 2026 World Cup play-off against Gabon in a row over outstanding payments.,NEGATIVE,0.991571307182312,-0.991571307182312
12,NewsNews,https://www.bbc.com/news/world/africa,NEGATIVE,0.21918333942691484,48,4 hrs ago Africa Sport Sudan civil war Sudan capital hit by drone attacks a day after RSF agrees to truce - reports The reported strikes come as the military-led government says it would be wary of agreeing to a ceasefire.,NEGATIVE,0.9968826770782471,-0.9968826770782471
12,NewsNews,https://www.bbc.com/news/world/africa,NEGATIVE,0.21918333942691484,48,"'Our job is only killing' - how Sudan's brutal militia carried out a massacre BBC Verify tracks how the RSF killed unarmed people in a massacre that humanitarian officials believe left 2,000 dead.",NEGATIVE,0.9913520812988281,-0.9913520812988281
12,NewsNews,https://www.bbc.com/news/world/africa,NEGATIVE,0.21918333942691484,48,Sudan's life-saving community kitchens on verge of collapse This follows confirmation by a global hunger monitor that famine conditions are spreading in conflict zones.,NEGATIVE,0.9986953139305115,-0.9986953139305115
12,NewsNews,https://www.bbc.com/news/world/africa,NEGATIVE,0.21918333942691484,48,He made his money selling camels and gold.,POSITIVE,0.9630361199378967,0.9630361199378967
12,NewsNews,https://www.bbc.com/news/world/africa,NEGATIVE,0.21918333942691484,48,"Now this warlord controls half of Sudan Mohamed Hamdan Dagalo will either lead a breakaway state or seek to take control of the whole country, Sudanese say.",NEGATIVE,0.98990797996521,-0.98990797996521
12,NewsNews,https://www.bbc.com/news/world/africa,NEGATIVE,0.21918333942691484,48,'I was accused of spying and beaten' - a boy's escape from captured Sudan city A 12-year-old tells the BBC that in the chaos he lost contact with his family and is now on his own at a camp.,NEGATIVE,0.9974073767662048,-0.9974073767662048
12,NewsNews,https://www.bbc.com/news/world/africa,NEGATIVE,0.21918333942691484,48,"Features and analysis Ahead of the G20, is Johannesburg's city centre in ruins?",NEGATIVE,0.9239097237586975,-0.9239097237586975
12,NewsNews,https://www.bbc.com/news/world/africa,NEGATIVE,0.21918333942691484,48,Some residents in the heart of the South African city are living amid sewage in derelict buildings run by criminal gangs.,NEGATIVE,0.9990177154541016,-0.9990177154541016
12,NewsNews,https://www.bbc.com/news/world/africa,NEGATIVE,0.21918333942691484,48,"How the US overtook China as Africa's biggest foreign investor As the two nations vie for key materials, the US has regained the lead in foreign direct investments in African countries.",POSITIVE,0.9972467422485352,0.9972467422485352
12,NewsNews,https://www.bbc.com/news/world/africa,NEGATIVE,0.21918333942691484,48,"The ex-president's daughter who faces terror-related charges South African Duduzile Zuma-Sambudla, accused of stoking deadly protests, denies the charges.",NEGATIVE,0.9790792465209961,-0.9790792465209961
12,NewsNews,https://www.bbc.com/news/world/africa,NEGATIVE,0.21918333942691484,48,The president blamed for shattering Tanzania's aura of stability The manner of Samia Suluhu Hassan's re-election has earned the country a rare rebuke from the African Union.,NEGATIVE,0.9769426584243774,-0.9769426584243774
12,NewsNews,https://www.bbc.com/news/world/africa,NEGATIVE,0.21918333942691484,48,"Trove of records reveals Kenya's forgotten World War soldiers Thousands of Kenyans, who fought for Britain, are buried in unknown locations and were never commemorated.",NEGATIVE,0.9781776666641235,-0.9781776666641235
12,NewsNews,https://www.bbc.com/news/world/africa,NEGATIVE,0.21918333942691484,48,"Panache, parades and power: Africa's top shots A selection of the week's best photos from across the African continent and beyond.",POSITIVE,0.999818742275238,0.999818742275238
12,NewsNews,https://www.bbc.com/news/world/africa,NEGATIVE,0.21918333942691484,48,Are Christians being persecuted in Nigeria as Trump claims?,NEGATIVE,0.992447018623352,-0.992447018623352
12,NewsNews,https://www.bbc.com/news/world/africa,NEGATIVE,0.21918333942691484,48,Donald Trump says thousands of Christians are being killed in Nigeria - where has he got the numbers from?,NEGATIVE,0.9982970356941223,-0.9982970356941223
12,NewsNews,https://www.bbc.com/news/world/africa,NEGATIVE,0.21918333942691484,48,Can Trump expel South Africa from the G20?,NEGATIVE,0.9944755434989929,-0.9944755434989929
12,NewsNews,https://www.bbc.com/news/world/africa,NEGATIVE,0.21918333942691484,48,The US leader has repeatedly accused South Africa of persecuting its white minority - which Pretoria denies.,NEGATIVE,0.9854840636253357,-0.9854840636253357
12,NewsNews,https://www.bbc.com/news/world/africa,NEGATIVE,0.21918333942691484,48,"Sport Iwobi ready to face 'big brother' Aubameyang Alex Iwobi says Nigeria will have to ""lock up"" Gabon striker, and his former Arsenal team-mate, Pierre-Emerick Aubameyang when the sides meet in African play-offs for the 2026 World Cup.",POSITIVE,0.6754951477050781,0.6754951477050781
12,NewsNews,https://www.bbc.com/news/world/africa,NEGATIVE,0.21918333942691484,48,'Cutest comeback ever' - Jabeur announces pregnancy Former world number two Ons Jabeur announces that she is pregnant with her first child.,POSITIVE,0.9993731379508972,0.9993731379508972
12,NewsNews,https://www.bbc.com/news/world/africa,NEGATIVE,0.21918333942691484,48,Four into one - how do African World Cup play-offs work?,NEGATIVE,0.9991626739501953,-0.9991626739501953
12,NewsNews,https://www.bbc.com/news/world/africa,NEGATIVE,0.21918333942691484,48,"As Nigeria, Cameroon, DR Congo, Gabon face off in African play-offs, BBC Sport Africa looks at how one nation can still reach the 2026 World Cup.",POSITIVE,0.9967681169509888,0.9967681169509888
12,NewsNews,https://www.bbc.com/news/world/africa,NEGATIVE,0.21918333942691484,48,'Flying' Sarr easing Crystal Palace's Eze loss Ismaila Sarr shines as Crystal Palace earn first home victory in Europa Conference League this term.,POSITIVE,0.9996469020843506,0.9996469020843506
12,NewsNews,https://www.bbc.com/news/world/africa,NEGATIVE,0.21918333942691484,48,"Being Premier League's only black manager 'a privilege' - Sao Tome-born Nuno The West Ham boss says he is ""honoured"" to act as a role model and believes there are ""a lot"" of talented black coaches who can follow in his footsteps.",POSITIVE,0.9991624355316162,0.9991624355316162
12,NewsNews,https://www.bbc.com/news/world/africa,NEGATIVE,0.21918333942691484,48,"Watch/Listen 'His aura is amazing' - Iwobi on Aubameyang Speaking before Nigeria face Gabon in African play-offs for the World Cup, Alex Iwobi says Pierre-Emerick Aubameyang was his ""big brother"" at Arsenal.",POSITIVE,0.9995050430297852,0.9995050430297852
12,NewsNews,https://www.bbc.com/news/world/africa,NEGATIVE,0.21918333942691484,48,"The Kenyan start-up aiming to electrify African transport From fleets of e-bikes to individual riders, eWaka aims to sell across Africa's delivery market.",POSITIVE,0.9963889122009277,0.9963889122009277
12,NewsNews,https://www.bbc.com/news/world/africa,NEGATIVE,0.21918333942691484,48,"We will never accept stolen votes, says Cameroon opposition leader Cameroon opposition leader Issa Tchiroma Bakary is adamant that he's the winner of the presidential election.",POSITIVE,0.8454693555831909,0.8454693555831909
12,NewsNews,https://www.bbc.com/news/world/africa,NEGATIVE,0.21918333942691484,48,Tyson hails Congolese roots on Rumble in the Jungle visit Mike Tyson was a hit with boxing fans in Kinshasa after embracing his African roots as part of ongoing celebrations for the iconic Rumble in the Jungle.,POSITIVE,0.998604953289032,0.998604953289032
12,NewsNews,https://www.bbc.com/news/world/africa,NEGATIVE,0.21918333942691484,48,Thousands of grief-stricken mourners attend Raila Odinga's funeral Thousands of mourners attend the state funeral of former Prime Minister Raila Odinga in Nairobi.,POSITIVE,0.9929367899894714,0.9929367899894714
12,NewsNews,https://www.bbc.com/news/world/africa,NEGATIVE,0.21918333942691484,48,Programmes and podcasts Live: World Service for Africa Focus on Africa Podcast Three essential stories to round off your working day.,POSITIVE,0.9954102635383606,0.9954102635383606
12,NewsNews,https://www.bbc.com/news/world/africa,NEGATIVE,0.21918333942691484,48,Explaining the news from Africa.,POSITIVE,0.9962913990020752,0.9962913990020752
12,NewsNews,https://www.bbc.com/news/world/africa,NEGATIVE,0.21918333942691484,48,This is Africa Latest updates 47 mins ago Wife and son of Gabon's ousted leader given 20-year jail terms in two-day corruption trial They were not in court and have described the charges against them as “a legal farce”.,NEGATIVE,0.9851686954498291,-0.9851686954498291
12,NewsNews,https://www.bbc.com/news/world/africa,NEGATIVE,0.21918333942691484,48,47 mins ago 1 hr ago Nigerians praise young soldier for standing up to powerful minister The confrontation struck a chord with many Nigerians because of Nyesom Wike's political stature.,POSITIVE,0.9992188215255737,0.9992188215255737
12,NewsNews,https://www.bbc.com/news/world/africa,NEGATIVE,0.21918333942691484,48,"1 hr ago 1 hr ago At least six die in crush at Ghana military recruitment event Thousands had turned up to El-Wak stadium, in the capital Accra, with hopes of being enlisted.",NEGATIVE,0.9840498566627502,-0.9840498566627502
12,NewsNews,https://www.bbc.com/news/world/africa,NEGATIVE,0.21918333942691484,48,1 hr ago 4 hrs ago Brothers charged with South African rapper's murder after extradition The Ndimande brothers returned after a lengthy battle to block their extradition from Eswatini.,NEGATIVE,0.9933305382728577,-0.9933305382728577
12,NewsNews,https://www.bbc.com/news/world/africa,NEGATIVE,0.21918333942691484,48,"4 hrs ago 15 hrs ago How jihadists have brought a nation to a standstill with their fuel blockade Mali has been paralysed by a fuel blockade, which has disrupted transport, schools, hospitals and more.",NEGATIVE,0.9988757967948914,-0.9988757967948914
12,NewsNews,https://www.bbc.com/news/world/africa,NEGATIVE,0.21918333942691484,48,"15 hrs ago 22 hrs ago Investigators blame bad weather for helicopter crash that killed two ministers in Ghana Two months ago, a military helicopter plummeted in a dense forest, killing eight people.",NEGATIVE,0.9963153004646301,-0.9963153004646301
12,NewsNews,https://www.bbc.com/news/world/africa,NEGATIVE,0.21918333942691484,48,"22 hrs ago 23 hrs ago 'There was a state of terror': Sudan hospital worker describes fleeing before alleged massacre ""I have lost the people whose faces I used to see smiling,"" says Abdu-Rabbu Ahmed after escaping el-Fasher.",NEGATIVE,0.9982302784919739,-0.9982302784919739
12,NewsNews,https://www.bbc.com/news/world/africa,NEGATIVE,0.21918333942691484,48,23 hrs ago 1 day ago Anger over 'wanted notice' for Nigeria's ex-oil minister Timipre Sylva His spokesman says it is politically motivated and he will contact the EFCC on his return from the UK.,NEGATIVE,0.8949936628341675,-0.8949936628341675
12,NewsNews,https://www.bbc.com/news/world/africa,NEGATIVE,0.21918333942691484,48,1 day ago 1 day ago Ghana's Asante king welcomes return of artefacts from the UK and South Africa They include items looted by British colonial soldiers and others from the AngloGold Ashanti mining firm.,POSITIVE,0.978683352470398,0.978683352470398
12,NewsNews,https://www.bbc.com/news/world/africa,NEGATIVE,0.21918333942691484,48,1 day ago 1 2 3 4 5 ... 12,POSITIVE,0.6439946889877319,0.6439946889877319
13,NewsNews,https://www.bbc.com/news/world/asia,NEGATIVE,0.47834729927557484,27,News News Asia China India How the Japan PM's Taiwan remarks provoked the fury of China Sanae Takaichi drew fire after suggesting Tokyo could take military action if Beijing attacked Taiwan.,NEGATIVE,0.9898006319999695,-0.9898006319999695
13,NewsNews,https://www.bbc.com/news/world/asia,NEGATIVE,0.47834729927557484,27,"17 hrs ago Asia All five members of K-pop group NewJeans set to return to label after legal battle NewJeans has been locked in a legal battle with Ador, accusing the agencyof mistreatment and manipulation, which it denies.",NEGATIVE,0.9917599558830261,-0.9917599558830261
13,NewsNews,https://www.bbc.com/news/world/asia,NEGATIVE,0.47834729927557484,27,40 mins ago Asia Two popular gay dating platforms removed from Apple app store in China The removal of Blued and Finka has raised concerns amongst the LGBT community in the country.,NEGATIVE,0.9338119029998779,-0.9338119029998779
13,NewsNews,https://www.bbc.com/news/world/asia,NEGATIVE,0.47834729927557484,27,"13 hrs ago Asia Schools go hybrid as Delhi's air quality worsens Delhi's air quality has deteriorated to ""severe"" levels, which can seriously impact those with existing diseases.",NEGATIVE,0.9984608888626099,-0.9984608888626099
13,NewsNews,https://www.bbc.com/news/world/asia,NEGATIVE,0.47834729927557484,27,10 hrs ago Asia Thailand extradites owner of Myanmar scam city to China She Zhijiang is one of the biggest figures linked to South East Asia's cyberscam operations.,POSITIVE,0.9779055714607239,0.9779055714607239
13,NewsNews,https://www.bbc.com/news/world/asia,NEGATIVE,0.47834729927557484,27,9 hrs ago Asia Two meals for $1: Why China's youth are not spending Economic uncertainty is encouraging some young people to cut back on their spending.,NEGATIVE,0.8546955585479736,-0.8546955585479736
