article_index,title,url,avg_label,avg_score,num_sentences,sentence,sent_label,sent_score,sent_value
5,NewsNews,https://www.bbc.com/news/england,NEGATIVE,0.02406734541842812,38,That changed when he went to a corner shop.,NEGATIVE,0.9747657775878906,-0.9747657775878906
5,NewsNews,https://www.bbc.com/news/england,NEGATIVE,0.02406734541842812,38,'Huge milestone' as rare leopard cub born at zoo An Amur leopard cub is born at Dartmoor Zoo in a boost for conservation efforts.,POSITIVE,0.9998047947883606,0.9998047947883606
5,NewsNews,https://www.bbc.com/news/england,NEGATIVE,0.02406734541842812,38,"Other top stories Extra police powers after man shot and boy stabbed A 19-year-old man was shot on Friday, just hours after a boy, 15, was stabbed, say Merseyside Police.",POSITIVE,0.6019612550735474,0.6019612550735474
5,NewsNews,https://www.bbc.com/news/england,NEGATIVE,0.02406734541842812,38,Veterans reach Land's End after marching 925 miles The Bootneck Yomp challenge has raised for thousands of pounds for charities.,POSITIVE,0.9431983232498169,0.9431983232498169
5,NewsNews,https://www.bbc.com/news/england,NEGATIVE,0.02406734541842812,38,Swan rescued after being 'shot with catapult' The bird will make a full recovery but a charity believes more wildlife is being shot at.,POSITIVE,0.944940984249115,0.944940984249115
5,NewsNews,https://www.bbc.com/news/england,NEGATIVE,0.02406734541842812,38,"'I knew nothing about life outside of the army' Nick Bennion, 47, said when he left the army he 'knew nothing about the outside world"".",NEGATIVE,0.9914590120315552,-0.9914590120315552
5,NewsNews,https://www.bbc.com/news/england,NEGATIVE,0.02406734541842812,38,Eric Morecambe events will 'bring sunshine to all' Councillors back calls to mark Eric Morecambe's life on what would have been his 100th birthday.,POSITIVE,0.9993358254432678,0.9993358254432678
5,NewsNews,https://www.bbc.com/news/england,NEGATIVE,0.02406734541842812,38,"Features & Analysis Heinous crimes and nursery rhymes: Inside HMP Wakefield The jail, where paedophile singer Ian Watkins was killed, has a long and unusual past.",NEGATIVE,0.9630072712898254,-0.9630072712898254
5,NewsNews,https://www.bbc.com/news/england,NEGATIVE,0.02406734541842812,38,"'Sticky floors, 60p pints - our club made us the UK's synth city' The Limit hosted acts such as The Human League and Def Leppard from 1978 to 1991.",POSITIVE,0.8876998424530029,0.8876998424530029
5,NewsNews,https://www.bbc.com/news/england,NEGATIVE,0.02406734541842812,38,"Couple share ADHD life to help others understand Rox was diagnosed with ADHD at 36 and says it led to a ""much happier and nicer life"".",POSITIVE,0.9991858601570129,0.9991858601570129
5,NewsNews,https://www.bbc.com/news/england,NEGATIVE,0.02406734541842812,38,Palin reflects on friendship with Python Terry Jones Sir Michael Palin will be talking about his friendship with former co-star Terry Jones in Reading.,POSITIVE,0.9985232949256897,0.9985232949256897
5,NewsNews,https://www.bbc.com/news/england,NEGATIVE,0.02406734541842812,38,"'Breaking my glasses led to brain tumour diagnosis' Mark Barrow says the diagnosis came as a shock, and is being monitored regularly.",NEGATIVE,0.9780645370483398,-0.9780645370483398
5,NewsNews,https://www.bbc.com/news/england,NEGATIVE,0.02406734541842812,38,"Watch/Listen Watch: Cyclist's near miss as car crashes off road Video shows the moment a car skids sideways, narrowly missing a man on a bike, before crashing.",NEGATIVE,0.9987154006958008,-0.9987154006958008
5,NewsNews,https://www.bbc.com/news/england,NEGATIVE,0.02406734541842812,38,16 hrs ago Northamptonshire Watch: Norwich City fans protest ahead of Manning sacking Hundreds of Norwich City fans protest outside Carrow Road after the Canaries' seventh straight home loss.,NEGATIVE,0.986794650554657,-0.986794650554657
5,NewsNews,https://www.bbc.com/news/england,NEGATIVE,0.02406734541842812,38,2 hrs ago Norfolk Greg James takes to skies with Red Arrows Pudsey Bear challenges Radio 1's Greg James to raise money for disadvantaged children in the UK.,POSITIVE,0.975385308265686,0.975385308265686
5,NewsNews,https://www.bbc.com/news/england,NEGATIVE,0.02406734541842812,38,4 days ago Lincolnshire Shoplifter's getaway foiled by chief constable Sir Stephen Watson spotted the thief and thwarted his escape.,NEGATIVE,0.985313892364502,-0.985313892364502
5,NewsNews,https://www.bbc.com/news/england,NEGATIVE,0.02406734541842812,38,"1 day ago Manchester 'It's on the wonk and covered in brown': Town ridicules its Christmas tree Passers-by criticise the fir's many browning needles, with one man saying it looks ""a bit dead"".",NEGATIVE,0.9974057078361511,-0.9974057078361511
5,NewsNews,https://www.bbc.com/news/england,NEGATIVE,0.02406734541842812,38,2 days ago Cambridgeshire Sport England beat physical Fiji for ninth consecutive win England score four second-half tries to see off Fiji in their second autumn international at Allianz Stadium.,POSITIVE,0.9983545541763306,0.9983545541763306
5,NewsNews,https://www.bbc.com/news/england,NEGATIVE,0.02406734541842812,38,Impressive Norris on Sao Paulo pole after sprint win McLaren's Lando Norris takes pole position for the Sao Paulo Grand Prix with Oscar Piastri fourth and Max Verstappen down in 16th.,POSITIVE,0.9921431541442871,0.9921431541442871
5,NewsNews,https://www.bbc.com/news/england,NEGATIVE,0.02406734541842812,38,Latest updates 2 hrs ago England beat physical Fiji for ninth consecutive win England score four second-half tries to see off Fiji in their second autumn international at Allianz Stadium.,POSITIVE,0.9984824061393738,0.9984824061393738
5,NewsNews,https://www.bbc.com/news/england,NEGATIVE,0.02406734541842812,38,2 hrs ago 3 hrs ago Veterans reach Land's End after marching 925 miles The Bootneck Yomp challenge has raised for thousands of pounds for charities.,POSITIVE,0.5754843354225159,0.5754843354225159
5,NewsNews,https://www.bbc.com/news/england,NEGATIVE,0.02406734541842812,38,3 hrs ago 9 hrs ago Village hall shuts for roof repairs Cury village hall was built during World War One as a mess hut for Royal Naval Air Station Mullion.,NEGATIVE,0.9986856579780579,-0.9986856579780579
5,NewsNews,https://www.bbc.com/news/england,NEGATIVE,0.02406734541842812,38,"9 hrs ago 10 hrs ago Car driver dies in crash with lorry The man, aged in his 70s, was driving a Mercedes car which crashed with an HGV, police say.",NEGATIVE,0.9958990216255188,-0.9958990216255188
5,NewsNews,https://www.bbc.com/news/england,NEGATIVE,0.02406734541842812,38,10 hrs ago 10 hrs ago Yorkshire news quiz of the week - test your knowledge How much Yorkshire news can you remember from the past seven days?,NEGATIVE,0.9989299178123474,-0.9989299178123474
5,NewsNews,https://www.bbc.com/news/england,NEGATIVE,0.02406734541842812,38,"10 hrs ago 10 hrs ago 'It's got to be about us', choir says on new film The Choral closely resembles the story of Huddersfield Choral Society during World War One.",NEGATIVE,0.7513141632080078,-0.7513141632080078
5,NewsNews,https://www.bbc.com/news/england,NEGATIVE,0.02406734541842812,38,10 hrs ago 11 hrs ago 'Huge milestone' as rare leopard cub born at zoo An Amur leopard cub is born at Dartmoor Zoo in a boost for conservation efforts.,POSITIVE,0.999659538269043,0.999659538269043
5,NewsNews,https://www.bbc.com/news/england,NEGATIVE,0.02406734541842812,38,11 hrs ago 14 hrs ago Residential special school to close in December Funding for Bradstow School is cut by Wandsworth Council due to its financial viability.,NEGATIVE,0.9994850158691406,-0.9994850158691406
5,NewsNews,https://www.bbc.com/news/england,NEGATIVE,0.02406734541842812,38,"14 hrs ago 15 hrs ago Man charged over Gatwick Airport luggage theft John Brooks, 52, from Crawley, has been charged with theft and criminal damage.",NEGATIVE,0.97184818983078,-0.97184818983078
5,NewsNews,https://www.bbc.com/news/england,NEGATIVE,0.02406734541842812,38,15 hrs ago 1 2 3 4 5 ... 12,POSITIVE,0.7229626774787903,0.7229626774787903
6,NewsNews,https://www.bbc.com/news/northern_ireland,NEGATIVE,0.35813411821921665,48,News News N. Ireland N. Ireland Politics Pedestrian killed after being hit by car in Coleraine named Police have said Jamie Mitchell was 24 years old and from the Portrush area.,NEGATIVE,0.9925282001495361,-0.9925282001495361
6,NewsNews,https://www.bbc.com/news/northern_ireland,NEGATIVE,0.35813411821921665,48,"6 hrs ago Northern Ireland 'Changing rooms being used as classrooms,' as special school pupil numbers rise One school principal says the increase has led to changing rooms being used as classrooms and added pressure on teachers.",NEGATIVE,0.9854296445846558,-0.9854296445846558
6,NewsNews,https://www.bbc.com/news/northern_ireland,NEGATIVE,0.35813411821921665,48,22 hrs ago Northern Ireland FAI approves motion to call on Uefa to ban Israel The FAI has approved a motion to call on Uefa to ban Israel from European club and international competitions.,NEGATIVE,0.5139415860176086,-0.5139415860176086
6,NewsNews,https://www.bbc.com/news/northern_ireland,NEGATIVE,0.35813411821921665,48,"2 hrs ago Irish Football 'Shining a light on female rock bands' and celebrating grassroots The festival, taking place until 16 November, is dedicated to local artists and spread across 27 venues.",POSITIVE,0.9992139339447021,0.9992139339447021
6,NewsNews,https://www.bbc.com/news/northern_ireland,NEGATIVE,0.35813411821921665,48,"15 hrs ago Northern Ireland How a plan to redraw the Irish border fell apart In the early years of partition, the exact line the border took was still very much up for debate.",NEGATIVE,0.9835200905799866,-0.9835200905799866
6,NewsNews,https://www.bbc.com/news/northern_ireland,NEGATIVE,0.35813411821921665,48,"16 hrs ago Huge sense of pride to play Roy Keane in new film, says Cork actor The film is based on the fallout between Roy Keane and Mick McCarthy during Ireland's 2002 World Cup preparations.",POSITIVE,0.9990546107292175,0.9990546107292175
6,NewsNews,https://www.bbc.com/news/northern_ireland,NEGATIVE,0.35813411821921665,48,44 mins ago Northern Ireland Will the new night buses save Belfast's nightlife?,NEGATIVE,0.9981557726860046,-0.9981557726860046
6,NewsNews,https://www.bbc.com/news/northern_ireland,NEGATIVE,0.35813411821921665,48,A new late-night bus pilot aims to improve people getting in and out of Belfast late on weekends - but the city's night czar says it is a case of use it or lose it.,NEGATIVE,0.9994820952415466,-0.9994820952415466
6,NewsNews,https://www.bbc.com/news/northern_ireland,NEGATIVE,0.35813411821921665,48,16 hrs ago Northern Ireland In case you missed it 'A hike in school meal prices could leave families struggling' The cost of a school dinner for primary and special school pupils will go up by 50p from £2.60 to £3.10.,NEGATIVE,0.9948817491531372,-0.9948817491531372
6,NewsNews,https://www.bbc.com/news/northern_ireland,NEGATIVE,0.35813411821921665,48,"Town takes on Amazon with 'our version of Black Friday' Ballymena Discount Day runs from 9:00 GMT - 21:00 on Thursday, with more than 80 businesses offering promotions.",NEGATIVE,0.9456266760826111,-0.9456266760826111
6,NewsNews,https://www.bbc.com/news/northern_ireland,NEGATIVE,0.35813411821921665,48,Pupils 'appear to have been forgotten' in merger of three schools Causeway Academy is a new integrated school which is a merger of three existing north coast schools.,NEGATIVE,0.9979342222213745,-0.9979342222213745
6,NewsNews,https://www.bbc.com/news/northern_ireland,NEGATIVE,0.35813411821921665,48,"Features & Analysis Knitters create thousands of poppies to mark Remembrance Day Displays of military uniforms, diaries and medals are among the ways Ahoghill and Richhill are marking Remembrance Day.",POSITIVE,0.9990928173065186,0.9990928173065186
6,NewsNews,https://www.bbc.com/news/northern_ireland,NEGATIVE,0.35813411821921665,48,"Trauma and Trespasses in new Gillian Anderson Troubles drama Based on Louise Kennedy's novel, the Channel 4 drama looks at forbidden love in 1975 Holywood.",NEGATIVE,0.9480356574058533,-0.9480356574058533
6,NewsNews,https://www.bbc.com/news/northern_ireland,NEGATIVE,0.35813411821921665,48,Why is a council paying businesses to let the public use their toilets?,NEGATIVE,0.9982091188430786,-0.9982091188430786
6,NewsNews,https://www.bbc.com/news/northern_ireland,NEGATIVE,0.35813411821921665,48,"The scheme is the only one of its kind in Northern Ireland, with businesses receiving £300 to £800 per year.",NEGATIVE,0.7187315225601196,-0.7187315225601196
6,NewsNews,https://www.bbc.com/news/northern_ireland,NEGATIVE,0.35813411821921665,48,Pavement parking 'a daily problem' as officials push ahead with ban A man with a visual impairment speaks of his anger at the daily obstacles created by drivers parking on pavements.,NEGATIVE,0.9819141030311584,-0.9819141030311584
6,NewsNews,https://www.bbc.com/news/northern_ireland,NEGATIVE,0.35813411821921665,48,"Foyle & West Car burnt out in racially-motivated hate crime It happened in the Irish Green Street area of the town in the early hours of Friday, police say.",NEGATIVE,0.9983512163162231,-0.9983512163162231
6,NewsNews,https://www.bbc.com/news/northern_ireland,NEGATIVE,0.35813411821921665,48,Man dies after being struck by car The man was pronounced dead at the scene following a collision near Grange Lane on Thursday.,NEGATIVE,0.9989640712738037,-0.9989640712738037
6,NewsNews,https://www.bbc.com/news/northern_ireland,NEGATIVE,0.35813411821921665,48,"Lyra McKee murder accused denied pub job bail change Jordan Devine, from Londonderry, is charged with murdering Ms McKee on 18 April 2019.",NEGATIVE,0.9633821845054626,-0.9633821845054626
6,NewsNews,https://www.bbc.com/news/northern_ireland,NEGATIVE,0.35813411821921665,48,"Government freezes assets linked to New IRA It is also imposing sanctions on Kieran Gallagher, from Londonderry, who it believes is involved in terrorist activity.",NEGATIVE,0.9943364262580872,-0.9943364262580872
6,NewsNews,https://www.bbc.com/news/northern_ireland,NEGATIVE,0.35813411821921665,48,"Listen: North West Today A round-up of local news, sport and weather across the north west of Northern Ireland.",POSITIVE,0.9958023428916931,0.9958023428916931
6,NewsNews,https://www.bbc.com/news/northern_ireland,NEGATIVE,0.35813411821921665,48,"Republic of Ireland Extremists threatened to attack a mosque and migrant hotels, court hears Garrett Pollock, 35, from Annalong, County Down, and Karolis Peckauskas, 38, from Drogheda, County Louth, appeared before a special court sitting.",NEGATIVE,0.9884458780288696,-0.9884458780288696
6,NewsNews,https://www.bbc.com/news/northern_ireland,NEGATIVE,0.35813411821921665,48,Infants' remains found at Tuam site excavation Excavators say it will take time to determine if the remains date from the time of a former mother-and-baby home at Tuam.,NEGATIVE,0.9984619617462158,-0.9984619617462158
6,NewsNews,https://www.bbc.com/news/northern_ireland,NEGATIVE,0.35813411821921665,48,"Two men arrested after fire at asylum accommodation Gardaí commenced an investigation into the alleged attempted arson of the property in Drogheda, County Louth.",NEGATIVE,0.9743314385414124,-0.9743314385414124
6,NewsNews,https://www.bbc.com/news/northern_ireland,NEGATIVE,0.35813411821921665,48,Hurling star DJ Carey jailed over fake cancer claims Former Kilkenny hurler is jailed for five-and-a-half years for defrauding people by falsely claiming he had cancer.,NEGATIVE,0.9948164820671082,-0.9948164820671082
6,NewsNews,https://www.bbc.com/news/northern_ireland,NEGATIVE,0.35813411821921665,48,"Man denies murdering pensioner in street robbery Peter Augustine is accused of attacking and murdering John Mackey, 87, in Manor House on 6 May 2025.",NEGATIVE,0.9480056166648865,-0.9480056166648865
6,NewsNews,https://www.bbc.com/news/northern_ireland,NEGATIVE,0.35813411821921665,48,More BBC News NI on iPlayer & Sounds Good Morning Ulster Wake up to Good Morning Ulster and get all the news and analysis from home and abroad.,POSITIVE,0.9683663249015808,0.9683663249015808
6,NewsNews,https://www.bbc.com/news/northern_ireland,NEGATIVE,0.35813411821921665,48,The Nolan Show Breaking news and hard-hitting talk about the big stories of the day.,POSITIVE,0.9997394680976868,0.9997394680976868
6,NewsNews,https://www.bbc.com/news/northern_ireland,NEGATIVE,0.35813411821921665,48,Talkback Highlights from Talkback.,POSITIVE,0.976185142993927,0.976185142993927
6,NewsNews,https://www.bbc.com/news/northern_ireland,NEGATIVE,0.35813411821921665,48,William Crawley and guests discuss the news headlines.,POSITIVE,0.9976305961608887,0.9976305961608887
6,NewsNews,https://www.bbc.com/news/northern_ireland,NEGATIVE,0.35813411821921665,48,Evening Extra All the day’s news and analysis with Richard Morgan.,POSITIVE,0.9880174398422241,0.9880174398422241
6,NewsNews,https://www.bbc.com/news/northern_ireland,NEGATIVE,0.35813411821921665,48,BBC Newsline The latest news for Northern Ireland.,POSITIVE,0.9590707421302795,0.9590707421302795
6,NewsNews,https://www.bbc.com/news/northern_ireland,NEGATIVE,0.35813411821921665,48,The State of Us Tara Mills and Declan Harvey react and reflect on news stories in a BBC NI podcast.,NEGATIVE,0.8977723717689514,-0.8977723717689514
6,NewsNews,https://www.bbc.com/news/northern_ireland,NEGATIVE,0.35813411821921665,48,Red Lines The back-stop’s here?,NEGATIVE,0.9966791868209839,-0.9966791868209839
6,NewsNews,https://www.bbc.com/news/northern_ireland,NEGATIVE,0.35813411821921665,48,Bad puns with top political coverage from BBC Northern Ireland.,NEGATIVE,0.9947400689125061,-0.9947400689125061
6,NewsNews,https://www.bbc.com/news/northern_ireland,NEGATIVE,0.35813411821921665,48,The View Mark Carruthers provides comment and expert analysis on the week's political news Spotlight Hard-hitting investigations on the stories that matter in Northern Ireland.,POSITIVE,0.999180257320404,0.999180257320404
6,NewsNews,https://www.bbc.com/news/northern_ireland,NEGATIVE,0.35813411821921665,48,"Sunday Politics Northern Ireland Mark Carruthers with the latest political news, interviews and debate.",POSITIVE,0.9979939460754395,0.9979939460754395
6,NewsNews,https://www.bbc.com/news/northern_ireland,NEGATIVE,0.35813411821921665,48,"Latest updates 44 mins ago Huge sense of pride to play Roy Keane in new film, says Cork actor The film is based on the fallout between Roy Keane and Mick McCarthy during Ireland's 2002 World Cup preparations.",POSITIVE,0.9991724491119385,0.9991724491119385
6,NewsNews,https://www.bbc.com/news/northern_ireland,NEGATIVE,0.35813411821921665,48,44 mins ago 6 hrs ago Pedestrian killed after being hit by car in Coleraine named Police have said Jamie Mitchell was 24 years old and from the Portrush area.,NEGATIVE,0.9856605529785156,-0.9856605529785156
6,NewsNews,https://www.bbc.com/news/northern_ireland,NEGATIVE,0.35813411821921665,48,6 hrs ago 14 hrs ago 'Use it or lose it' as new late-night buses announced Translink announced details of a pilot scheme that will see night buses running on Friday and Saturdays from the end of the month.,NEGATIVE,0.983234167098999,-0.983234167098999
6,NewsNews,https://www.bbc.com/news/northern_ireland,NEGATIVE,0.35813411821921665,48,"14 hrs ago 15 hrs ago 'Shining a light on female rock bands' and celebrating grassroots The festival, taking place until 16 November, is dedicated to local artists and spread across 27 venues.",POSITIVE,0.9989026784896851,0.9989026784896851
6,NewsNews,https://www.bbc.com/news/northern_ireland,NEGATIVE,0.35813411821921665,48,15 hrs ago 16 hrs ago Will the new night buses save Belfast's nightlife?,NEGATIVE,0.9966968297958374,-0.9966968297958374
6,NewsNews,https://www.bbc.com/news/northern_ireland,NEGATIVE,0.35813411821921665,48,A new late-night bus pilot aims to improve people getting in and out of Belfast late on weekends - but the city's night czar says it is a case of use it or lose it.,NEGATIVE,0.9994820952415466,-0.9994820952415466
6,NewsNews,https://www.bbc.com/news/northern_ireland,NEGATIVE,0.35813411821921665,48,"16 hrs ago 22 hrs ago 'Changing rooms being used as classrooms,' as special school pupil numbers rise One school principal says the increase has led to changing rooms being used as classrooms and added pressure on teachers.",NEGATIVE,0.9918844699859619,-0.9918844699859619
6,NewsNews,https://www.bbc.com/news/northern_ireland,NEGATIVE,0.35813411821921665,48,"22 hrs ago 1 day ago Youth club closed after masked gang shout sectarian abuse Stephen Dallas, from the Bytes Project, says the youth club is closed this weekend due to safety concerns.",NEGATIVE,0.9983835220336914,-0.9983835220336914
6,NewsNews,https://www.bbc.com/news/northern_ireland,NEGATIVE,0.35813411821921665,48,"1 day ago 1 day ago Car burnt out in racially-motivated hate crime It happened in the Irish Green Street area of the town in the early hours of Friday, police say.",NEGATIVE,0.9916444420814514,-0.9916444420814514
6,NewsNews,https://www.bbc.com/news/northern_ireland,NEGATIVE,0.35813411821921665,48,"1 day ago 1 day ago Lyra McKee murder accused denied pub job bail change Jordan Devine, from Londonderry, is charged with murdering Ms McKee on 18 April 2019.",NEGATIVE,0.9581916928291321,-0.9581916928291321
6,NewsNews,https://www.bbc.com/news/northern_ireland,NEGATIVE,0.35813411821921665,48,1 day ago 1 2 3 4 5 ... 12,POSITIVE,0.6439946889877319,0.6439946889877319
7,NewsNews,https://www.bbc.com/news/northern_ireland/northern_ireland_politics,NEGATIVE,0.9705705990393957,12,News News N. Ireland N. Ireland Politics Little-Pengelly turns down Irish presidential inauguration invite Northern Ireland's deputy first minister says she is unable to attend Catherine Connolly's inauguration due to Remembrance Day commitments.,NEGATIVE,0.998462438583374,-0.998462438583374
7,NewsNews,https://www.bbc.com/news/northern_ireland/northern_ireland_politics,NEGATIVE,0.9705705990393957,12,"1 day ago Northern Ireland Politics PSNI pay deal possible before end of year, says Long The justice minister was speaking after the health minister announced he has been given approval to award pay parity to healthcare workers.",NEGATIVE,0.9880736470222473,-0.9880736470222473
7,NewsNews,https://www.bbc.com/news/northern_ireland/northern_ireland_politics,NEGATIVE,0.9705705990393957,12,"1 day ago Northern Ireland Politics Guidance for businesses on NI's post-Brexit trade deal 'not fit for purpose' The panel said information was ""poorly presented, unwieldy and needs to be significantly improved"".",NEGATIVE,0.9997352957725525,-0.9997352957725525
7,NewsNews,https://www.bbc.com/news/northern_ireland/northern_ireland_politics,NEGATIVE,0.9705705990393957,12,"3 days ago Northern Ireland Politics MLAs told cooperation over environment agency is 'crucial' Andrew Muir says assembly members should ""put their money where their mouth is"" and support the plan for an independent environment agency.",NEGATIVE,0.9615788459777832,-0.9615788459777832
7,NewsNews,https://www.bbc.com/news/northern_ireland/northern_ireland_politics,NEGATIVE,0.9705705990393957,12,"4 days ago Northern Ireland Politics Backdated health workers' pay award to go ahead, says minister A pay offer aimed at avoiding industrial action by healthcare workers has been made by the Department of Health.",NEGATIVE,0.9919305443763733,-0.9919305443763733
7,NewsNews,https://www.bbc.com/news/northern_ireland/northern_ireland_politics,NEGATIVE,0.9705705990393957,12,"2 days ago Northern Ireland 'Sinister attack' on Alliance headquarters 'tried to incite fear' It was reported on Wednesday that graffiti had been sprayed onto external windows, door shutters and a fence.",NEGATIVE,0.9983416795730591,-0.9983416795730591
7,NewsNews,https://www.bbc.com/news/northern_ireland/northern_ireland_politics,NEGATIVE,0.9705705990393957,12,"2 days ago Northern Ireland Stormont choices 'may add to funding pressures', says Benn Hilary Benn refused to be drawn on whether the Budget later this month would involve tax rises.",NEGATIVE,0.9963486194610596,-0.9963486194610596
7,NewsNews,https://www.bbc.com/news/northern_ireland/northern_ireland_politics,NEGATIVE,0.9705705990393957,12,"3 days ago Northern Ireland Politics Any tax increase must be 'fair and progressive' UK Chancellor Rachel Reeves refuses to rule out rises, saying she will make the ""necessary choices"".",NEGATIVE,0.9795385003089905,-0.9795385003089905
7,NewsNews,https://www.bbc.com/news/northern_ireland/northern_ireland_politics,NEGATIVE,0.9705705990393957,12,"Israel trip given 'clean bill of health', minister says Stormont's Education Minister Paul Givan continues to face criticism over his six-day tour of Israel.",NEGATIVE,0.9945329427719116,-0.9945329427719116
7,NewsNews,https://www.bbc.com/news/northern_ireland/northern_ireland_politics,NEGATIVE,0.9705705990393957,12,Council vote no confidence in education minister after walking out The motion proposed by Sinn Féin councillor Caoimhín McCann was approved by 40 votes to 15.,NEGATIVE,0.7415415048599243,-0.7415415048599243
7,NewsNews,https://www.bbc.com/news/northern_ireland/northern_ireland_politics,NEGATIVE,0.9705705990393957,12,"Education minister says he has been 'vilified' over Israel trip The DUP says Paul Givan is ""going nowhere"" after PBP submit a no confidence motion which is backed by Sinn Féin and the SDLP.",NEGATIVE,0.998670220375061,-0.998670220375061
7,NewsNews,https://www.bbc.com/news/northern_ireland/northern_ireland_politics,NEGATIVE,0.9705705990393957,12,"Education minister's Israel trip a 'propaganda mission', say Alliance Nick Mathison says there is ""questionable judgement"" around Paul Givan attending the trip, due to it being paid for by Israel.",NEGATIVE,0.9980929493904114,-0.9980929493904114
